datum a čas,domácí,hosté,skóre,hřiště,pzn.,akce,Datum utkání,Čas utkání,%Date,Timestamp,utkání,@Tremesna,Soupeř,Doma/Venku,název soutěže,zkratka soutěže,kategorie soutěže,pořadí,poznámka
17.08.2025 17:00,FC Libotov,TJ Baník Žacléř A,3 : 6 (PK:0:0),Libotov,,zápis uzavřen delegace,2025-08-17,17:00:00,739480,2025-08-17 17:00:00,FC Libotov - TJ Baník Žacléř A,False,FC Libotov,V,8.liga - OP II.třídy muži,Muži,Muzi,1,
17.08.2025 17:00,TJ Strážné,TJ Sokol Staré Buky,4 : 5 (PK:0:0),D.Branná,,zápis uzavřen delegace,2025-08-17,17:00:00,739480,2025-08-17 17:00:00,TJ Strážné - TJ Sokol Staré Buky,False,TJ Strážné,V,8.liga - OP II.třídy muži,Muži,Muzi,1,
16.08.2025 17:00,TJ Jiskra Kocbeře,Fotbal Club Mladé Buky A,1 : 9 (PK:0:0),Kocbeře,,zápis uzavřen delegace,2025-08-16,17:00:00,739479,2025-08-16 17:00:00,TJ Jiskra Kocbeře - Fotbal Club Mladé Buky A,False,TJ Jiskra Kocbeře,V,8.liga - OP II.třídy muži,Muži,Muzi,1,
16.08.2025 14:00,FK Sokol Volanov,Sokol Vítězná,2 : 1 (PK:0:0),Volanov,"/ , Původní termín: 16.08.2025 17:00",zápis uzavřen delegace,2025-08-16,14:00:00,739479,2025-08-16 14:00:00,FK Sokol Volanov - Sokol Vítězná,False,FK Sokol Volanov,V,8.liga - OP II.třídy muži,Muži,Muzi,1,  Původní termín: 16.08.2025 17:00
16.08.2025 17:00,FK Poříčí u Trutnova,TJ Spartak Pilníkov,1 : 2 (PK:0:0),Poříčí,,zápis uzavřen delegace,2025-08-16,17:00:00,739479,2025-08-16 17:00:00,FK Poříčí u Trutnova - TJ Spartak Pilníkov,False,FK Poříčí u Trutnova,V,8.liga - OP II.třídy muži,Muži,Muzi,1,
16.08.2025 17:00,TJ Tatran Hostinné A,Bílá Třemešná/Dvůr Králové B,2 : 2 (PK:0:0),Hostinné,,zápis uzavřen delegace,2025-08-16,17:00:00,739479,2025-08-16 17:00:00,TJ Tatran Hostinné A - Bílá Třemešná/Dvůr Králové B,True,TJ Tatran Hostinné A,V,8.liga - OP II.třídy muži,Muži,Muzi,1,
24.08.2025 17:00,TJ Lánov,FK Sokol Volanov,0 : 2 (PK:0:0),Lánov,,zápis uzavřen delegace,2025-08-24,17:00:00,739487,2025-08-24 17:00:00,TJ Lánov - FK Sokol Volanov,False,TJ Lánov,V,8.liga - OP II.třídy muži,Muži,Muzi,1,
23.08.2025 17:00,TJ Sokol Staré Buky,TJ Tatran Hostinné A,2 : 1 (PK:0:0),St.Buky,,zápis uzavřen delegace,2025-08-23,17:00:00,739486,2025-08-23 17:00:00,TJ Sokol Staré Buky - TJ Tatran Hostinné A,False,TJ Sokol Staré Buky,V,8.liga - OP II.třídy muži,Muži,Muzi,1,
23.08.2025 17:00,TJ Spartak Pilníkov,TJ Baník Žacléř A,2 : 2 (PK:0:0),Pilníkov,,zápis uzavřen delegace,2025-08-23,17:00:00,739486,2025-08-23 17:00:00,TJ Spartak Pilníkov - TJ Baník Žacléř A,False,TJ Spartak Pilníkov,V,8.liga - OP II.třídy muži,Muži,Muzi,1,
23.08.2025 17:00,Sokol Vítězná,TJ Jiskra Kocbeře,7 : 0 (PK:0:0),Vítězná,,zápis uzavřen delegace,2025-08-23,17:00:00,739486,2025-08-23 17:00:00,Sokol Vítězná - TJ Jiskra Kocbeře,False,Sokol Vítězná,V,8.liga - OP II.třídy muži,Muži,Muzi,1,
23.08.2025 17:00,Fotbal Club Mladé Buky A,TJ Strážné,9 : 0 (PK:0:0),M.Buky,,zápis uzavřen delegace,2025-08-23,17:00:00,739486,2025-08-23 17:00:00,Fotbal Club Mladé Buky A - TJ Strážné,False,Fotbal Club Mladé Buky A,V,8.liga - OP II.třídy muži,Muži,Muzi,1,
23.08.2025 17:00,Bílá Třemešná/Dvůr Králové B,FK Poříčí u Trutnova,3 : 1 (PK:0:0),B.Třemešná,,zápis uzavřen delegace,2025-08-23,17:00:00,739486,2025-08-23 17:00:00,Bílá Třemešná/Dvůr Králové B - FK Poříčí u Trutnova,True,FK Poříčí u Trutnova,D,8.liga - OP II.třídy muži,Muži,Muzi,1,
31.08.2025 17:00,TJ Strážné,Sokol Vítězná,3 : 1 (PK:0:0),D.Branná,,zápis uzavřen delegace,2025-08-31,17:00:00,739494,2025-08-31 17:00:00,TJ Strážné - Sokol Vítězná,False,TJ Strážné,V,8.liga - OP II.třídy muži,Muži,Muzi,1,
31.08.2025 17:00,TJ Lánov,FC Libotov,6 : 1 (PK:0:0),Lánov,,zápis uzavřen delegace,2025-08-31,17:00:00,739494,2025-08-31 17:00:00,TJ Lánov - FC Libotov,False,TJ Lánov,V,8.liga - OP II.třídy muži,Muži,Muzi,1,
30.08.2025 17:00,Bílá Třemešná/Dvůr Králové B,TJ Baník Žacléř A,3 : 0 (PK:0:0),B.Třemešná,,zápis uzavřen delegace,2025-08-30,17:00:00,739493,2025-08-30 17:00:00,Bílá Třemešná/Dvůr Králové B - TJ Baník Žacléř A,True,TJ Baník Žacléř A,D,8.liga - OP II.třídy muži,Muži,Muzi,1,
30.08.2025 17:00,FK Poříčí u Trutnova,TJ Sokol Staré Buky,2 : 0 (PK:0:0),Poříčí,,zápis uzavřen delegace,2025-08-30,17:00:00,739493,2025-08-30 17:00:00,FK Poříčí u Trutnova - TJ Sokol Staré Buky,False,FK Poříčí u Trutnova,V,8.liga - OP II.třídy muži,Muži,Muzi,1,
30.08.2025 17:00,TJ Tatran Hostinné A,Fotbal Club Mladé Buky A,7 : 1 (PK:0:0),Hostinné,,zápis uzavřen delegace,2025-08-30,17:00:00,739493,2025-08-30 17:00:00,TJ Tatran Hostinné A - Fotbal Club Mladé Buky A,False,TJ Tatran Hostinné A,V,8.liga - OP II.třídy muži,Muži,Muzi,1,
30.08.2025 17:00,FK Sokol Volanov,TJ Jiskra Kocbeře,2 : 0 (PK:0:0),Volanov,,zápis uzavřen delegace,2025-08-30,17:00:00,739493,2025-08-30 17:00:00,FK Sokol Volanov - TJ Jiskra Kocbeře,False,FK Sokol Volanov,V,8.liga - OP II.třídy muži,Muži,Muzi,1,
07.09.2025 17:00,FC Libotov,FK Sokol Volanov,4 : 2 (PK:0:0),Libotov,,zápis uzavřen delegace,2025-09-07,17:00:00,739501,2025-09-07 17:00:00,FC Libotov - FK Sokol Volanov,False,FC Libotov,V,8.liga - OP II.třídy muži,Muži,Muzi,1,
06.09.2025 17:00,Fotbal Club Mladé Buky A,FK Poříčí u Trutnova,4 : 0 (PK:0:0),M.Buky,,zápis uzavřen delegace,2025-09-06,17:00:00,739500,2025-09-06 17:00:00,Fotbal Club Mladé Buky A - FK Poříčí u Trutnova,False,Fotbal Club Mladé Buky A,V,8.liga - OP II.třídy muži,Muži,Muzi,1,
06.09.2025 17:00,Sokol Vítězná,TJ Tatran Hostinné A,2 : 1 (PK:0:0),Vítězná,,zápis uzavřen delegace,2025-09-06,17:00:00,739500,2025-09-06 17:00:00,Sokol Vítězná - TJ Tatran Hostinné A,False,Sokol Vítězná,V,8.liga - OP II.třídy muži,Muži,Muzi,1,
06.09.2025 17:00,TJ Jiskra Kocbeře,TJ Strážné,4 : 2 (PK:0:0),Kocbeře,,zápis uzavřen delegace,2025-09-06,17:00:00,739500,2025-09-06 17:00:00,TJ Jiskra Kocbeře - TJ Strážné,False,TJ Jiskra Kocbeře,V,8.liga - OP II.třídy muži,Muži,Muzi,1,
06.09.2025 17:00,TJ Sokol Staré Buky,TJ Baník Žacléř A,3 : 2 (PK:0:0),St.Buky,,zápis uzavřen delegace,2025-09-06,17:00:00,739500,2025-09-06 17:00:00,TJ Sokol Staré Buky - TJ Baník Žacléř A,False,TJ Sokol Staré Buky,V,8.liga - OP II.třídy muži,Muži,Muzi,1,
06.09.2025 17:00,TJ Spartak Pilníkov,TJ Lánov,3 : 1 (PK:0:0),Pilníkov,,zápis uzavřen delegace,2025-09-06,17:00:00,739500,2025-09-06 17:00:00,TJ Spartak Pilníkov - TJ Lánov,False,TJ Spartak Pilníkov,V,8.liga - OP II.třídy muži,Muži,Muzi,1,
06.09.2025 17:00,TJ Jiskra Kocbeře,TJ Strážné,4 : 2 (PK:0:0),Kocbeře,,zápis uzavřen delegace,2025-09-06,17:00:00,739500,2025-09-06 17:00:00,TJ Jiskra Kocbeře - TJ Strážné,False,TJ Jiskra Kocbeře,V,8.liga - OP II.třídy muži,Muži,Muzi,1,
31.12.2025 00:00,TJ Lánov,Bílá Třemešná/Dvůr Králové B,-- : -- (PK:0:0),Lánov,ODLOŽENO,nezahájen delegace,2025-12-31,00:00:00,739616,2025-12-31 00:00:00,TJ Lánov - Bílá Třemešná/Dvůr Králové B,True,TJ Lánov,V,8.liga - OP II.třídy muži,Muži,Muzi,1,ODLOŽENO
14.09.2025 17:00,Fotbal Club Mladé Buky A,TJ Baník Žacléř A,2 : 2 (PK:0:0),M.Buky,", Původní termín: 13.09.2025 17:00",zápis uzavřen delegace,2025-09-14,17:00:00,739508,2025-09-14 17:00:00,Fotbal Club Mladé Buky A - TJ Baník Žacléř A,False,Fotbal Club Mladé Buky A,V,8.liga - OP II.třídy muži,Muži,Muzi,1, Původní termín: 13.09.2025 17:00
14.09.2025 17:00,FC Libotov,TJ Spartak Pilníkov,2 : 9 (PK:0:0),Libotov,,zápis uzavřen delegace,2025-09-14,17:00:00,739508,2025-09-14 17:00:00,FC Libotov - TJ Spartak Pilníkov,False,FC Libotov,V,8.liga - OP II.třídy muži,Muži,Muzi,1,
14.09.2025 17:00,TJ Lánov,Bílá Třemešná/Dvůr Králové B,Nezahájeno  (PK:0:0),Lánov,,zápis uzavřen delegace,2025-09-14,17:00:00,739508,2025-09-14 17:00:00,TJ Lánov - Bílá Třemešná/Dvůr Králové B,True,TJ Lánov,V,8.liga - OP II.třídy muži,Muži,Muzi,1,
13.09.2025 17:00,FK Poříčí u Trutnova,Sokol Vítězná,0 : 3 (PK:0:0),Poříčí,,zápis uzavřen delegace,2025-09-13,17:00:00,739507,2025-09-13 17:00:00,FK Poříčí u Trutnova - Sokol Vítězná,False,FK Poříčí u Trutnova,V,8.liga - OP II.třídy muži,Muži,Muzi,1,
13.09.2025 14:00,FK Sokol Volanov,TJ Strážné,5 : 1 (PK:0:0),Volanov,"/ , Původní termín: 13.09.2025 17:00",zápis uzavřen delegace,2025-09-13,14:00:00,739507,2025-09-13 14:00:00,FK Sokol Volanov - TJ Strážné,False,FK Sokol Volanov,V,8.liga - OP II.třídy muži,Muži,Muzi,1,  Původní termín: 13.09.2025 17:00
13.09.2025 17:00,TJ Tatran Hostinné A,TJ Jiskra Kocbeře,11 : 2 (PK:0:0),Hostinné,,zápis uzavřen delegace,2025-09-13,17:00:00,739507,2025-09-13 17:00:00,TJ Tatran Hostinné A - TJ Jiskra Kocbeře,False,TJ Tatran Hostinné A,V,8.liga - OP II.třídy muži,Muži,Muzi,1,
21.09.2025 16:30,TJ Lánov,TJ Sokol Staré Buky,1 : 2 (PK:0:0),Lánov,,zápis uzavřen delegace,2025-09-21,16:30:00,739515,2025-09-21 16:30:00,TJ Lánov - TJ Sokol Staré Buky,False,TJ Lánov,V,8.liga - OP II.třídy muži,Muži,Muzi,1,
21.09.2025 16:30,TJ Strážné,TJ Tatran Hostinné A,1 : 1 (PK:0:0),D.Branná,,zápis uzavřen delegace,2025-09-21,16:30:00,739515,2025-09-21 16:30:00,TJ Strážné - TJ Tatran Hostinné A,False,TJ Strážné,V,8.liga - OP II.třídy muži,Muži,Muzi,1,
20.09.2025 16:30,TJ Jiskra Kocbeře,FK Poříčí u Trutnova,4 : 5 (PK:0:0),Kocbeře,,zápis uzavřen delegace,2025-09-20,16:30:00,739514,2025-09-20 16:30:00,TJ Jiskra Kocbeře - FK Poříčí u Trutnova,False,TJ Jiskra Kocbeře,V,8.liga - OP II.třídy muži,Muži,Muzi,1,
20.09.2025 13:00,TJ Spartak Pilníkov,FK Sokol Volanov,5 : 1 (PK:0:0),Pilníkov,"/ , Původní termín: 20.09.2025 16:30",zápis uzavřen delegace,2025-09-20,13:00:00,739514,2025-09-20 13:00:00,TJ Spartak Pilníkov - FK Sokol Volanov,False,TJ Spartak Pilníkov,V,8.liga - OP II.třídy muži,Muži,Muzi,1,  Původní termín: 20.09.2025 16:30
20.09.2025 16:30,Bílá Třemešná/Dvůr Králové B,FC Libotov,6 : 0 (PK:0:0),B.Třemešná,,zápis uzavřen delegace,2025-09-20,16:30:00,739514,2025-09-20 16:30:00,Bílá Třemešná/Dvůr Králové B - FC Libotov,True,FC Libotov,D,8.liga - OP II.třídy muži,Muži,Muzi,1,
20.09.2025 16:30,Sokol Vítězná,TJ Baník Žacléř A,2 : 4 (PK:0:0),Vítězná,,zápis uzavřen delegace,2025-09-20,16:30:00,739514,2025-09-20 16:30:00,Sokol Vítězná - TJ Baník Žacléř A,False,Sokol Vítězná,V,8.liga - OP II.třídy muži,Muži,Muzi,1,
28.09.2025 13:30,TJ Lánov,Fotbal Club Mladé Buky A,2 : 1 (PK:0:0),Lánov,,zápis uzavřen delegace,2025-09-28,13:30:00,739522,2025-09-28 13:30:00,TJ Lánov - Fotbal Club Mladé Buky A,False,TJ Lánov,V,8.liga - OP II.třídy muži,Muži,Muzi,1,
28.09.2025 16:30,FC Libotov,TJ Sokol Staré Buky,1 : 1 (PK:0:0),Libotov,,zápis uzavřen delegace,2025-09-28,16:30:00,739522,2025-09-28 16:30:00,FC Libotov - TJ Sokol Staré Buky,False,FC Libotov,V,8.liga - OP II.třídy muži,Muži,Muzi,1,
27.09.2025 16:30,TJ Jiskra Kocbeře,TJ Baník Žacléř A,3 : 6 (PK:0:0),Kocbeře,,zápis uzavřen delegace,2025-09-27,16:30:00,739521,2025-09-27 16:30:00,TJ Jiskra Kocbeře - TJ Baník Žacléř A,False,TJ Jiskra Kocbeře,V,8.liga - OP II.třídy muži,Muži,Muzi,1,
27.09.2025 16:30,FK Poříčí u Trutnova,TJ Strážné,3 : 0 (K) (PK:0:0),Poříčí,,zápis uzavřen delegace,2025-09-27,16:30:00,739521,2025-09-27 16:30:00,FK Poříčí u Trutnova - TJ Strážné,False,FK Poříčí u Trutnova,V,8.liga - OP II.třídy muži,Muži,Muzi,1,
27.09.2025 16:30,FK Sokol Volanov,TJ Tatran Hostinné A,0 : 1 (PK:0:0),Volanov,,zápis uzavřen delegace,2025-09-27,16:30:00,739521,2025-09-27 16:30:00,FK Sokol Volanov - TJ Tatran Hostinné A,False,FK Sokol Volanov,V,8.liga - OP II.třídy muži,Muži,Muzi,1,
27.09.2025 16:30,TJ Spartak Pilníkov,Bílá Třemešná/Dvůr Králové B,6 : 2 (PK:0:0),Pilníkov,,zápis uzavřen delegace,2025-09-27,16:30:00,739521,2025-09-27 16:30:00,TJ Spartak Pilníkov - Bílá Třemešná/Dvůr Králové B,True,TJ Spartak Pilníkov,V,8.liga - OP II.třídy muži,Muži,Muzi,1,
05.10.2025 13:00,TJ Strážné,TJ Baník Žacléř A,2 : 5 (PK:0:0),D.Branná,,zápis uzavřen delegace,2025-10-05,13:00:00,739529,2025-10-05 13:00:00,TJ Strážné - TJ Baník Žacléř A,False,TJ Strážné,V,8.liga - OP II.třídy muži,Muži,Muzi,1,
04.10.2025 16:00,Sokol Vítězná,TJ Lánov,4 : 0 (PK:0:0),Vítězná,,zápis uzavřen delegace,2025-10-04,16:00:00,739528,2025-10-04 16:00:00,Sokol Vítězná - TJ Lánov,False,Sokol Vítězná,V,8.liga - OP II.třídy muži,Muži,Muzi,1,
04.10.2025 16:00,Fotbal Club Mladé Buky A,FC Libotov,3 : 2 (PK:0:0),M.Buky,,zápis uzavřen delegace,2025-10-04,16:00:00,739528,2025-10-04 16:00:00,Fotbal Club Mladé Buky A - FC Libotov,False,Fotbal Club Mladé Buky A,V,8.liga - OP II.třídy muži,Muži,Muzi,1,
04.10.2025 16:00,Bílá Třemešná/Dvůr Králové B,FK Sokol Volanov,4 : 1 (PK:0:0),B.Třemešná,,zápis uzavřen delegace,2025-10-04,16:00:00,739528,2025-10-04 16:00:00,Bílá Třemešná/Dvůr Králové B - FK Sokol Volanov,True,FK Sokol Volanov,D,8.liga - OP II.třídy muži,Muži,Muzi,1,
04.10.2025 16:00,TJ Sokol Staré Buky,TJ Spartak Pilníkov,1 : 4 (PK:0:0),St.Buky,,zápis uzavřen delegace,2025-10-04,16:00:00,739528,2025-10-04 16:00:00,TJ Sokol Staré Buky - TJ Spartak Pilníkov,False,TJ Sokol Staré Buky,V,8.liga - OP II.třídy muži,Muži,Muzi,1,
04.10.2025 16:00,TJ Tatran Hostinné A,FK Poříčí u Trutnova,2 : 0 (PK:0:0),Hostinné,,zápis uzavřen delegace,2025-10-04,16:00:00,739528,2025-10-04 16:00:00,TJ Tatran Hostinné A - FK Poříčí u Trutnova,False,TJ Tatran Hostinné A,V,8.liga - OP II.třídy muži,Muži,Muzi,1,
12.10.2025 13:00,FC Libotov,Sokol Vítězná,2 : 2 (PK:0:0),Libotov,,zápis uzavřen delegace,2025-10-12,13:00:00,739536,2025-10-12 13:00:00,FC Libotov - Sokol Vítězná,False,FC Libotov,V,8.liga - OP II.třídy muži,Muži,Muzi,1,
12.10.2025 16:00,TJ Lánov,TJ Jiskra Kocbeře,4 : 1 (PK:0:0),Lánov,,zápis uzavřen delegace,2025-10-12,16:00:00,739536,2025-10-12 16:00:00,TJ Lánov - TJ Jiskra Kocbeře,False,TJ Lánov,V,8.liga - OP II.třídy muži,Muži,Muzi,1,
11.10.2025 16:00,Bílá Třemešná/Dvůr Králové B,TJ Sokol Staré Buky,1 : 1 (PK:0:0),B.Třemešná,,zápis uzavřen delegace,2025-10-11,16:00:00,739535,2025-10-11 16:00:00,Bílá Třemešná/Dvůr Králové B - TJ Sokol Staré Buky,True,TJ Sokol Staré Buky,D,8.liga - OP II.třídy muži,Muži,Muzi,1,
11.10.2025 16:00,TJ Tatran Hostinné A,TJ Baník Žacléř A,4 : 2 (PK:0:0),Hostinné,,zápis uzavřen delegace,2025-10-11,16:00:00,739535,2025-10-11 16:00:00,TJ Tatran Hostinné A - TJ Baník Žacléř A,False,TJ Tatran Hostinné A,V,8.liga - OP II.třídy muži,Muži,Muzi,1,
11.10.2025 16:00,TJ Spartak Pilníkov,Fotbal Club Mladé Buky A,3 : 1 (PK:0:0),Pilníkov,,zápis uzavřen delegace,2025-10-11,16:00:00,739535,2025-10-11 16:00:00,TJ Spartak Pilníkov - Fotbal Club Mladé Buky A,False,TJ Spartak Pilníkov,V,8.liga - OP II.třídy muži,Muži,Muzi,1,
11.10.2025 16:00,FK Sokol Volanov,FK Poříčí u Trutnova,2 : 0 (PK:0:0),Volanov,,zápis uzavřen delegace,2025-10-11,16:00:00,739535,2025-10-11 16:00:00,FK Sokol Volanov - FK Poříčí u Trutnova,False,FK Sokol Volanov,V,8.liga - OP II.třídy muži,Muži,Muzi,1,
19.10.2025 15:30,TJ Strážné,TJ Lánov,1 : 5 (PK:0:0),D.Branná,,zápis uzavřen delegace,2025-10-19,15:30:00,739543,2025-10-19 15:30:00,TJ Strážné - TJ Lánov,False,TJ Strážné,V,8.liga - OP II.třídy muži,Muži,Muzi,1,
18.10.2025 12:30,FK Poříčí u Trutnova,TJ Baník Žacléř A,1 : 3 (PK:0:0),Poříčí,,zápis uzavřen delegace,2025-10-18,12:30:00,739542,2025-10-18 12:30:00,FK Poříčí u Trutnova - TJ Baník Žacléř A,False,FK Poříčí u Trutnova,V,8.liga - OP II.třídy muži,Muži,Muzi,1,
18.10.2025 15:30,Fotbal Club Mladé Buky A,Bílá Třemešná/Dvůr Králové B,1 : 1 (PK:0:0),M.Buky,,zápis uzavřen delegace,2025-10-18,15:30:00,739542,2025-10-18 15:30:00,Fotbal Club Mladé Buky A - Bílá Třemešná/Dvůr Králové B,True,Fotbal Club Mladé Buky A,V,8.liga - OP II.třídy muži,Muži,Muzi,1,
18.10.2025 15:30,Sokol Vítězná,TJ Spartak Pilníkov,2 : 4 (PK:0:0),Vítězná,,zápis uzavřen delegace,2025-10-18,15:30:00,739542,2025-10-18 15:30:00,Sokol Vítězná - TJ Spartak Pilníkov,False,Sokol Vítězná,V,8.liga - OP II.třídy muži,Muži,Muzi,1,
18.10.2025 15:30,TJ Jiskra Kocbeře,FC Libotov,1 : 6 (PK:0:0),Kocbeře,,zápis uzavřen delegace,2025-10-18,15:30:00,739542,2025-10-18 15:30:00,TJ Jiskra Kocbeře - FC Libotov,False,TJ Jiskra Kocbeře,V,8.liga - OP II.třídy muži,Muži,Muzi,1,
18.10.2025 15:30,TJ Sokol Staré Buky,FK Sokol Volanov,0 : 3 (PK:0:0),St.Buky,,zápis uzavřen delegace,2025-10-18,15:30:00,739542,2025-10-18 15:30:00,TJ Sokol Staré Buky - FK Sokol Volanov,False,TJ Sokol Staré Buky,V,8.liga - OP II.třídy muži,Muži,Muzi,1,
26.10.2025 14:30,FC Libotov,TJ Strážné,2 : 0 (PK:0:0),Libotov,,zápis uzavřen delegace,2025-10-26,14:30:00,739550,2025-10-26 14:30:00,FC Libotov - TJ Strážné,False,FC Libotov,V,8.liga - OP II.třídy muži,Muži,Muzi,1,
26.10.2025 14:30,TJ Lánov,TJ Tatran Hostinné A,0 : 3 (PK:0:0),Lánov,,zápis uzavřen delegace,2025-10-26,14:30:00,739550,2025-10-26 14:30:00,TJ Lánov - TJ Tatran Hostinné A,False,TJ Lánov,V,8.liga - OP II.třídy muži,Muži,Muzi,1,
25.10.2025 14:30,TJ Spartak Pilníkov,TJ Jiskra Kocbeře,3 : 1 (PK:0:0),Pilníkov,,zápis uzavřen delegace,2025-10-25,14:30:00,739549,2025-10-25 14:30:00,TJ Spartak Pilníkov - TJ Jiskra Kocbeře,False,TJ Spartak Pilníkov,V,8.liga - OP II.třídy muži,Muži,Muzi,1,
25.10.2025 14:30,TJ Sokol Staré Buky,Fotbal Club Mladé Buky A,1 : 4 (PK:0:0),St.Buky,,zápis uzavřen delegace,2025-10-25,14:30:00,739549,2025-10-25 14:30:00,TJ Sokol Staré Buky - Fotbal Club Mladé Buky A,False,TJ Sokol Staré Buky,V,8.liga - OP II.třídy muži,Muži,Muzi,1,
25.10.2025 14:30,Bílá Třemešná/Dvůr Králové B,Sokol Vítězná,4 : 1 (PK:0:0),B.Třemešná,,zápis uzavřen delegace,2025-10-25,14:30:00,739549,2025-10-25 14:30:00,Bílá Třemešná/Dvůr Králové B - Sokol Vítězná,True,Sokol Vítězná,D,8.liga - OP II.třídy muži,Muži,Muzi,1,
25.10.2025 14:30,FK Sokol Volanov,TJ Baník Žacléř A,3 : 1 (PK:0:0),Volanov,,zápis uzavřen delegace,2025-10-25,14:30:00,739549,2025-10-25 14:30:00,FK Sokol Volanov - TJ Baník Žacléř A,False,FK Sokol Volanov,V,8.liga - OP II.třídy muži,Muži,Muzi,1,
02.11.2025 14:00,TJ Strážné,TJ Spartak Pilníkov,-- : -- (PK:0:0),D.Branná,,nezahájen delegace,2025-11-02,14:00:00,739557,2025-11-02 14:00:00,TJ Strážné - TJ Spartak Pilníkov,False,TJ Strážné,V,8.liga - OP II.třídy muži,Muži,Muzi,1,
01.11.2025 14:00,Sokol Vítězná,TJ Sokol Staré Buky,-- : -- (PK:0:0),Vítězná,", Původní termín: 01.11.2025 11:00",nezahájen delegace,2025-11-01,14:00:00,739556,2025-11-01 14:00:00,Sokol Vítězná - TJ Sokol Staré Buky,False,Sokol Vítězná,V,8.liga - OP II.třídy muži,Muži,Muzi,1, Původní termín: 01.11.2025 11:00
01.11.2025 14:00,Fotbal Club Mladé Buky A,FK Sokol Volanov,-- : -- (PK:0:0),M.Buky,,nezahájen delegace,2025-11-01,14:00:00,739556,2025-11-01 14:00:00,Fotbal Club Mladé Buky A - FK Sokol Volanov,False,Fotbal Club Mladé Buky A,V,8.liga - OP II.třídy muži,Muži,Muzi,1,
01.11.2025 14:00,FK Poříčí u Trutnova,TJ Lánov,-- : -- (PK:0:0),Poříčí,,nezahájen delegace,2025-11-01,14:00:00,739556,2025-11-01 14:00:00,FK Poříčí u Trutnova - TJ Lánov,False,FK Poříčí u Trutnova,V,8.liga - OP II.třídy muži,Muži,Muzi,1,
01.11.2025 14:00,TJ Jiskra Kocbeře,Bílá Třemešná/Dvůr Králové B,-- : -- (PK:0:0),Kocbeře,,nezahájen delegace,2025-11-01,14:00:00,739556,2025-11-01 14:00:00,TJ Jiskra Kocbeře - Bílá Třemešná/Dvůr Králové B,True,TJ Jiskra Kocbeře,V,8.liga - OP II.třídy muži,Muži,Muzi,1,
01.11.2025 14:00,TJ Tatran Hostinné A,FC Libotov,-- : -- (PK:0:0),Hostinné,,nezahájen delegace,2025-11-01,14:00:00,739556,2025-11-01 14:00:00,TJ Tatran Hostinné A - FC Libotov,False,TJ Tatran Hostinné A,V,8.liga - OP II.třídy muži,Muži,Muzi,1,
09.11.2025 14:00,FC Libotov,FK Poříčí u Trutnova,-- : -- (PK:0:0),Libotov,,nezahájen delegace,2025-11-09,14:00:00,739564,2025-11-09 14:00:00,FC Libotov - FK Poříčí u Trutnova,False,FC Libotov,V,8.liga - OP II.třídy muži,Muži,Muzi,1,
09.11.2025 14:00,TJ Lánov,TJ Baník Žacléř A,-- : -- (PK:0:0),Lánov,,nezahájen delegace,2025-11-09,14:00:00,739564,2025-11-09 14:00:00,TJ Lánov - TJ Baník Žacléř A,False,TJ Lánov,V,8.liga - OP II.třídy muži,Muži,Muzi,1,
08.11.2025 14:00,Bílá Třemešná/Dvůr Králové B,TJ Strážné,-- : -- (PK:0:0),B.Třemešná,,nezahájen delegace,2025-11-08,14:00:00,739563,2025-11-08 14:00:00,Bílá Třemešná/Dvůr Králové B - TJ Strážné,True,TJ Strážné,D,8.liga - OP II.třídy muži,Muži,Muzi,1,
08.11.2025 14:00,TJ Sokol Staré Buky,TJ Jiskra Kocbeře,-- : -- (PK:0:0),St.Buky,,nezahájen delegace,2025-11-08,14:00:00,739563,2025-11-08 14:00:00,TJ Sokol Staré Buky - TJ Jiskra Kocbeře,False,TJ Sokol Staré Buky,V,8.liga - OP II.třídy muži,Muži,Muzi,1,
08.11.2025 14:00,Fotbal Club Mladé Buky A,Sokol Vítězná,-- : -- (PK:0:0),M.Buky,,nezahájen delegace,2025-11-08,14:00:00,739563,2025-11-08 14:00:00,Fotbal Club Mladé Buky A - Sokol Vítězná,False,Fotbal Club Mladé Buky A,V,8.liga - OP II.třídy muži,Muži,Muzi,1,
08.11.2025 14:00,TJ Spartak Pilníkov,TJ Tatran Hostinné A,-- : -- (PK:0:0),Pilníkov,,nezahájen delegace,2025-11-08,14:00:00,739563,2025-11-08 14:00:00,TJ Spartak Pilníkov - TJ Tatran Hostinné A,False,TJ Spartak Pilníkov,V,8.liga - OP II.třídy muži,Muži,Muzi,1,
28.08.2025 16:00,SK Robousy,SK Červený Kostelec,3 : 2 (PK:0:0),Robousy,,zápis uzavřen delegace,2025-08-28,16:00:00,739491,2025-08-28 16:00:00,SK Robousy - SK Červený Kostelec,False,SK Robousy,V,KP mladšího dorostu U 17,Ml. dorost,Ml_dorost,3,
27.08.2025 18:00,FC Mladé Buky,FK Jaroměř,3 : 6 (PK:0:0),Mladé Buky,,zápis uzavřen delegace,2025-08-27,18:00:00,739490,2025-08-27 18:00:00,FC Mladé Buky - FK Jaroměř,False,FC Mladé Buky,V,KP mladšího dorostu U 17,Ml. dorost,Ml_dorost,3,
24.08.2025 14:30,TJ Slovan Broumov,TJ Jiskra Hořice,2 : 2 (PK:0:0),Broumov,,zápis uzavřen delegace,2025-08-24,14:30:00,739487,2025-08-24 14:30:00,TJ Slovan Broumov - TJ Jiskra Hořice,False,TJ Slovan Broumov,V,KP mladšího dorostu U 17,Ml. dorost,Ml_dorost,3,
24.08.2025 13:30,Lázně Bělohrad/Miletín,SK Česká Skalice,2 : 1 (PK:0:0),Lázně Bělohrad,,zápis uzavřen delegace,2025-08-24,13:30:00,739487,2025-08-24 13:30:00,Lázně Bělohrad/Miletín - SK Česká Skalice,False,Lázně Bělohrad/Miletín,V,KP mladšího dorostu U 17,Ml. dorost,Ml_dorost,3,
23.08.2025 14:45,MFK Trutnov,Spartak Police n. M.,5 : 3 (PK:0:0),Trutnov - H.S.M.,,zápis uzavřen delegace,2025-08-23,14:45:00,739486,2025-08-23 14:45:00,MFK Trutnov - Spartak Police n. M.,False,MFK Trutnov,V,KP mladšího dorostu U 17,Ml. dorost,Ml_dorost,3,
23.08.2025 14:00,Dvůr Králové/Bílá Třemešná,SK Jičín,2 : 11 (PK:0:0),Bílá Třemešná,,zápis uzavřen delegace,2025-08-23,14:00:00,739486,2025-08-23 14:00:00,Dvůr Králové/Bílá Třemešná - SK Jičín,True,SK Jičín,D,KP mladšího dorostu U 17,Ml. dorost,Ml_dorost,3,
31.08.2025 11:00,TJ Baník Žacléř,Lázně Bělohrad/Miletín,1 : 5 (PK:0:0),Lampertice,,zápis uzavřen delegace,2025-08-31,11:00:00,739494,2025-08-31 11:00:00,TJ Baník Žacléř - Lázně Bělohrad/Miletín,False,TJ Baník Žacléř,V,KP mladšího dorostu U 17,Ml. dorost,Ml_dorost,3,
31.08.2025 11:00,SK Česká Skalice,MFK Trutnov,3 : 10 (PK:0:0),Česká Skalice,,zápis uzavřen delegace,2025-08-31,11:00:00,739494,2025-08-31 11:00:00,SK Česká Skalice - MFK Trutnov,False,SK Česká Skalice,V,KP mladšího dorostu U 17,Ml. dorost,Ml_dorost,3,
30.08.2025 13:00,SK Jičín,FC Mladé Buky,3 : 0 (PK:0:0),"Lomnice, tráva","Hřiště: JC - UMT, Původní termín: 30.08.2025 13:00",zápis uzavřen delegace,2025-08-30,13:00:00,739493,2025-08-30 13:00:00,SK Jičín - FC Mladé Buky,False,SK Jičín,V,KP mladšího dorostu U 17,Ml. dorost,Ml_dorost,3,Hřiště: JC - UMT Původní termín: 30.08.2025 13:00
30.08.2025 10:30,TJ Jiskra Hořice,Dvůr Králové/Bílá Třemešná,1 : 5 (PK:0:0),Hořice,,zápis uzavřen delegace,2025-08-30,10:30:00,739493,2025-08-30 10:30:00,TJ Jiskra Hořice - Dvůr Králové/Bílá Třemešná,True,TJ Jiskra Hořice,V,KP mladšího dorostu U 17,Ml. dorost,Ml_dorost,3,
30.08.2025 14:00,FK Jaroměř,SK Robousy,11 : 0 (PK:0:0),Jaroměř,,zápis uzavřen delegace,2025-08-30,14:00:00,739493,2025-08-30 14:00:00,FK Jaroměř - SK Robousy,False,FK Jaroměř,V,KP mladšího dorostu U 17,Ml. dorost,Ml_dorost,3,
30.08.2025 13:30,Spartak Police n. M.,TJ Slovan Broumov,4 : 1 (PK:0:0),Police n. M.,,zápis uzavřen delegace,2025-08-30,13:30:00,739493,2025-08-30 13:30:00,Spartak Police n. M. - TJ Slovan Broumov,False,Spartak Police n. M.,V,KP mladšího dorostu U 17,Ml. dorost,Ml_dorost,3,
07.09.2025 14:30,TJ Slovan Broumov,SK Česká Skalice,1 : 4 (PK:0:0),Broumov,,zápis uzavřen delegace,2025-09-07,14:30:00,739501,2025-09-07 14:30:00,TJ Slovan Broumov - SK Česká Skalice,False,TJ Slovan Broumov,V,KP mladšího dorostu U 17,Ml. dorost,Ml_dorost,3,
07.09.2025 11:15,SK Robousy,SK Jičín,0 : 5 (PK:0:0),Robousy,,zápis uzavřen delegace,2025-09-07,11:15:00,739501,2025-09-07 11:15:00,SK Robousy - SK Jičín,False,SK Robousy,V,KP mladšího dorostu U 17,Ml. dorost,Ml_dorost,3,
07.09.2025 14:30,SK Červený Kostelec,FK Jaroměř,1 : 10 (PK:0:0),Červený Kostelec,,zápis uzavřen delegace,2025-09-07,14:30:00,739501,2025-09-07 14:30:00,SK Červený Kostelec - FK Jaroměř,False,SK Červený Kostelec,V,KP mladšího dorostu U 17,Ml. dorost,Ml_dorost,3,
06.09.2025 10:00,MFK Trutnov,TJ Baník Žacléř,3 : 1 (PK:0:0),"Trutnov, tráva",,zápis uzavřen delegace,2025-09-06,10:00:00,739500,2025-09-06 10:00:00,MFK Trutnov - TJ Baník Žacléř,False,MFK Trutnov,V,KP mladšího dorostu U 17,Ml. dorost,Ml_dorost,3,
06.09.2025 13:00,Dvůr Králové/Bílá Třemešná,Spartak Police n. M.,2 : 5 (PK:0:0),Dvůr Králové,,zápis uzavřen delegace,2025-09-06,13:00:00,739500,2025-09-06 13:00:00,Dvůr Králové/Bílá Třemešná - Spartak Police n. M.,True,Spartak Police n. M.,D,KP mladšího dorostu U 17,Ml. dorost,Ml_dorost,3,
06.09.2025 14:00,FC Mladé Buky,TJ Jiskra Hořice,7 : 1 (PK:0:0),Mladé Buky,,zápis uzavřen delegace,2025-09-06,14:00:00,739500,2025-09-06 14:00:00,FC Mladé Buky - TJ Jiskra Hořice,False,FC Mladé Buky,V,KP mladšího dorostu U 17,Ml. dorost,Ml_dorost,3,
14.09.2025 13:00,TJ Jiskra Hořice,SK Robousy,0 : 3 (PK:0:0),Hořice,,zápis uzavřen delegace,2025-09-14,13:00:00,739508,2025-09-14 13:00:00,TJ Jiskra Hořice - SK Robousy,False,TJ Jiskra Hořice,V,KP mladšího dorostu U 17,Ml. dorost,Ml_dorost,3,
14.09.2025 10:00,SK Česká Skalice,Dvůr Králové/Bílá Třemešná,3 : 2 (PK:0:0),Česká Skalice,,zápis uzavřen delegace,2025-09-14,10:00:00,739508,2025-09-14 10:00:00,SK Česká Skalice - Dvůr Králové/Bílá Třemešná,True,SK Česká Skalice,V,KP mladšího dorostu U 17,Ml. dorost,Ml_dorost,3,
14.09.2025 13:30,Lázně Bělohrad/Miletín,MFK Trutnov,1 : 3 (PK:0:0),Lázně Bělohrad,,zápis uzavřen delegace,2025-09-14,13:30:00,739508,2025-09-14 13:30:00,Lázně Bělohrad/Miletín - MFK Trutnov,False,Lázně Bělohrad/Miletín,V,KP mladšího dorostu U 17,Ml. dorost,Ml_dorost,3,
14.09.2025 14:00,TJ Baník Žacléř,TJ Slovan Broumov,3 : 0 (PK:0:0),Lampertice,,zápis uzavřen delegace,2025-09-14,14:00:00,739508,2025-09-14 14:00:00,TJ Baník Žacléř - TJ Slovan Broumov,False,TJ Baník Žacléř,V,KP mladšího dorostu U 17,Ml. dorost,Ml_dorost,3,
13.09.2025 13:30,Spartak Police n. M.,FC Mladé Buky,0 : 2 (PK:0:0),Police n. M.,,zápis uzavřen delegace,2025-09-13,13:30:00,739507,2025-09-13 13:30:00,Spartak Police n. M. - FC Mladé Buky,False,Spartak Police n. M.,V,KP mladšího dorostu U 17,Ml. dorost,Ml_dorost,3,
13.09.2025 13:00,SK Jičín,SK Červený Kostelec,7 : 1 (PK:0:0),"Lomnice, tráva",,zápis uzavřen delegace,2025-09-13,13:00:00,739507,2025-09-13 13:00:00,SK Jičín - SK Červený Kostelec,False,SK Jičín,V,KP mladšího dorostu U 17,Ml. dorost,Ml_dorost,3,
21.09.2025 11:00,SK Červený Kostelec,TJ Jiskra Hořice,1 : 1 (PK:0:0),Červený Kostelec,,zápis uzavřen delegace,2025-09-21,11:00:00,739515,2025-09-21 11:00:00,SK Červený Kostelec - TJ Jiskra Hořice,False,SK Červený Kostelec,V,KP mladšího dorostu U 17,Ml. dorost,Ml_dorost,3,
21.09.2025 11:00,SK Robousy,Spartak Police n. M.,3 : 4 (PK:0:0),Robousy,,zápis uzavřen delegace,2025-09-21,11:00:00,739515,2025-09-21 11:00:00,SK Robousy - Spartak Police n. M.,False,SK Robousy,V,KP mladšího dorostu U 17,Ml. dorost,Ml_dorost,3,
21.09.2025 14:00,TJ Slovan Broumov,Lázně Bělohrad/Miletín,0 : 4 (PK:0:0),Broumov,,zápis uzavřen delegace,2025-09-21,14:00:00,739515,2025-09-21 14:00:00,TJ Slovan Broumov - Lázně Bělohrad/Miletín,False,TJ Slovan Broumov,V,KP mladšího dorostu U 17,Ml. dorost,Ml_dorost,3,
20.09.2025 10:00,FC Mladé Buky,SK Česká Skalice,2 : 1 (PK:0:0),Mladé Buky,,zápis uzavřen delegace,2025-09-20,10:00:00,739514,2025-09-20 10:00:00,FC Mladé Buky - SK Česká Skalice,False,FC Mladé Buky,V,KP mladšího dorostu U 17,Ml. dorost,Ml_dorost,3,
20.09.2025 13:30,FK Jaroměř,SK Jičín,6 : 3 (PK:0:0),Jaroměř,,zápis uzavřen delegace,2025-09-20,13:30:00,739514,2025-09-20 13:30:00,FK Jaroměř - SK Jičín,False,FK Jaroměř,V,KP mladšího dorostu U 17,Ml. dorost,Ml_dorost,3,
20.09.2025 14:00,Dvůr Králové/Bílá Třemešná,TJ Baník Žacléř,1 : 2 (PK:0:0),Dvůr Králové,,zápis uzavřen delegace,2025-09-20,14:00:00,739514,2025-09-20 14:00:00,Dvůr Králové/Bílá Třemešná - TJ Baník Žacléř,True,TJ Baník Žacléř,D,KP mladšího dorostu U 17,Ml. dorost,Ml_dorost,3,
09.10.2025 16:15,SK Česká Skalice,SK Robousy,1 : 0 (PK:0:0),Česká Skalice,,zápis uzavřen delegace,2025-10-09,16:15:00,739533,2025-10-09 16:15:00,SK Česká Skalice - SK Robousy,False,SK Česká Skalice,V,KP mladšího dorostu U 17,Ml. dorost,Ml_dorost,3,
28.09.2025 10:00,TJ Baník Žacléř,FC Mladé Buky,1 : 4 (PK:0:0),Lampertice,,zápis uzavřen delegace,2025-09-28,10:00:00,739522,2025-09-28 10:00:00,TJ Baník Žacléř - FC Mladé Buky,False,TJ Baník Žacléř,V,KP mladšího dorostu U 17,Ml. dorost,Ml_dorost,3,
28.09.2025 13:00,Lázně Bělohrad/Miletín,Dvůr Králové/Bílá Třemešná,1 : 3 (PK:0:0),Lázně Bělohrad,,zápis uzavřen delegace,2025-09-28,13:00:00,739522,2025-09-28 13:00:00,Lázně Bělohrad/Miletín - Dvůr Králové/Bílá Třemešná,True,Lázně Bělohrad/Miletín,V,KP mladšího dorostu U 17,Ml. dorost,Ml_dorost,3,
28.09.2025 13:30,TJ Jiskra Hořice,FK Jaroměř,0 : 8 (PK:0:0),Myštěves,,zápis uzavřen delegace,2025-09-28,13:30:00,739522,2025-09-28 13:30:00,TJ Jiskra Hořice - FK Jaroměř,False,TJ Jiskra Hořice,V,KP mladšího dorostu U 17,Ml. dorost,Ml_dorost,3,
27.09.2025 14:15,MFK Trutnov,TJ Slovan Broumov,15 : 0 (PK:0:0),Trutnov - H.S.M.,,zápis uzavřen delegace,2025-09-27,14:15:00,739521,2025-09-27 14:15:00,MFK Trutnov - TJ Slovan Broumov,False,MFK Trutnov,V,KP mladšího dorostu U 17,Ml. dorost,Ml_dorost,3,
27.09.2025 13:30,Spartak Police n. M.,SK Červený Kostelec,1 : 1 (PK:0:0),Police n. M.,,zápis uzavřen delegace,2025-09-27,13:30:00,739521,2025-09-27 13:30:00,Spartak Police n. M. - SK Červený Kostelec,False,Spartak Police n. M.,V,KP mladšího dorostu U 17,Ml. dorost,Ml_dorost,3,
05.10.2025 10:00,SK Jičín,TJ Jiskra Hořice,8 : 0 (PK:0:0),"Jičín, UMT",,zápis uzavřen delegace,2025-10-05,10:00:00,739529,2025-10-05 10:00:00,SK Jičín - TJ Jiskra Hořice,False,SK Jičín,V,KP mladšího dorostu U 17,Ml. dorost,Ml_dorost,3,
05.10.2025 11:00,SK Červený Kostelec,SK Česká Skalice,2 : 2 (PK:0:0),Červený Kostelec,,zápis uzavřen delegace,2025-10-05,11:00:00,739529,2025-10-05 11:00:00,SK Červený Kostelec - SK Česká Skalice,False,SK Červený Kostelec,V,KP mladšího dorostu U 17,Ml. dorost,Ml_dorost,3,
04.10.2025 13:00,FK Jaroměř,Spartak Police n. M.,4 : 4 (PK:0:0),Jaroměř,,zápis uzavřen delegace,2025-10-04,13:00:00,739528,2025-10-04 13:00:00,FK Jaroměř - Spartak Police n. M.,False,FK Jaroměř,V,KP mladšího dorostu U 17,Ml. dorost,Ml_dorost,3,
04.10.2025 11:00,FC Mladé Buky,Lázně Bělohrad/Miletín,3 : 1 (PK:0:0),Mladé Buky,,zápis uzavřen delegace,2025-10-04,11:00:00,739528,2025-10-04 11:00:00,FC Mladé Buky - Lázně Bělohrad/Miletín,False,FC Mladé Buky,V,KP mladšího dorostu U 17,Ml. dorost,Ml_dorost,3,
04.10.2025 16:00,SK Robousy,TJ Baník Žacléř,6 : 0 (PK:0:0),Robousy,,zápis uzavřen delegace,2025-10-04,16:00:00,739528,2025-10-04 16:00:00,SK Robousy - TJ Baník Žacléř,False,SK Robousy,V,KP mladšího dorostu U 17,Ml. dorost,Ml_dorost,3,
04.10.2025 13:00,Dvůr Králové/Bílá Třemešná,MFK Trutnov,1 : 5 (PK:0:0),Dvůr Králové,,zápis uzavřen delegace,2025-10-04,13:00:00,739528,2025-10-04 13:00:00,Dvůr Králové/Bílá Třemešná - MFK Trutnov,True,MFK Trutnov,D,KP mladšího dorostu U 17,Ml. dorost,Ml_dorost,3,
22.10.2025 16:00,TJ Slovan Broumov,Dvůr Králové/Bílá Třemešná,1 : 3 (PK:0:0),Broumov,,zápis uzavřen delegace,2025-10-22,16:00:00,739546,2025-10-22 16:00:00,TJ Slovan Broumov - Dvůr Králové/Bílá Třemešná,True,TJ Slovan Broumov,V,KP mladšího dorostu U 17,Ml. dorost,Ml_dorost,3,
12.10.2025 13:00,TJ Baník Žacléř,SK Červený Kostelec,7 : 4 (PK:0:0),Lampertice,,zápis uzavřen delegace,2025-10-12,13:00:00,739536,2025-10-12 13:00:00,TJ Baník Žacléř - SK Červený Kostelec,False,TJ Baník Žacléř,V,KP mladšího dorostu U 17,Ml. dorost,Ml_dorost,3,
11.10.2025 12:30,Lázně Bělohrad/Miletín,SK Robousy,0 : 1 (PK:0:0),Miletín,,zápis uzavřen delegace,2025-10-11,12:30:00,739535,2025-10-11 12:30:00,Lázně Bělohrad/Miletín - SK Robousy,False,Lázně Bělohrad/Miletín,V,KP mladšího dorostu U 17,Ml. dorost,Ml_dorost,3,
11.10.2025 10:45,SK Česká Skalice,FK Jaroměř,2 : 12 (PK:0:0),Česká Skalice,,zápis uzavřen delegace,2025-10-11,10:45:00,739535,2025-10-11 10:45:00,SK Česká Skalice - FK Jaroměř,False,SK Česká Skalice,V,KP mladšího dorostu U 17,Ml. dorost,Ml_dorost,3,
11.10.2025 13:45,MFK Trutnov,FC Mladé Buky,5 : 2 (PK:0:0),Trutnov - H.S.M.,,zápis uzavřen delegace,2025-10-11,13:45:00,739535,2025-10-11 13:45:00,MFK Trutnov - FC Mladé Buky,False,MFK Trutnov,V,KP mladšího dorostu U 17,Ml. dorost,Ml_dorost,3,
11.10.2025 13:15,Spartak Police n. M.,SK Jičín,2 : 3 (PK:0:0),Police n. M.,,zápis uzavřen delegace,2025-10-11,13:15:00,739535,2025-10-11 13:15:00,Spartak Police n. M. - SK Jičín,False,Spartak Police n. M.,V,KP mladšího dorostu U 17,Ml. dorost,Ml_dorost,3,
19.10.2025 13:00,TJ Jiskra Hořice,Spartak Police n. M.,0 : 6 (PK:0:0),Hořice,,zápis uzavřen delegace,2025-10-19,13:00:00,739543,2025-10-19 13:00:00,TJ Jiskra Hořice - Spartak Police n. M.,False,TJ Jiskra Hořice,V,KP mladšího dorostu U 17,Ml. dorost,Ml_dorost,3,
19.10.2025 11:00,SK Červený Kostelec,Lázně Bělohrad/Miletín,0 : 2 (PK:0:0),Červený Kostelec,,zápis uzavřen delegace,2025-10-19,11:00:00,739543,2025-10-19 11:00:00,SK Červený Kostelec - Lázně Bělohrad/Miletín,False,SK Červený Kostelec,V,KP mladšího dorostu U 17,Ml. dorost,Ml_dorost,3,
19.10.2025 13:00,SK Jičín,SK Česká Skalice,7 : 1 (PK:0:0),"Jičín, UMT",,zápis uzavřen delegace,2025-10-19,13:00:00,739543,2025-10-19 13:00:00,SK Jičín - SK Česká Skalice,False,SK Jičín,V,KP mladšího dorostu U 17,Ml. dorost,Ml_dorost,3,
19.10.2025 15:30,SK Robousy,MFK Trutnov,0 : 5 (PK:0:0),Robousy,,zápis uzavřen delegace,2025-10-19,15:30:00,739543,2025-10-19 15:30:00,SK Robousy - MFK Trutnov,False,SK Robousy,V,KP mladšího dorostu U 17,Ml. dorost,Ml_dorost,3,
18.10.2025 12:30,FK Jaroměř,TJ Baník Žacléř,5 : 0 (PK:0:0),Jaroměř,,zápis uzavřen delegace,2025-10-18,12:30:00,739542,2025-10-18 12:30:00,FK Jaroměř - TJ Baník Žacléř,False,FK Jaroměř,V,KP mladšího dorostu U 17,Ml. dorost,Ml_dorost,3,
18.10.2025 12:30,FC Mladé Buky,TJ Slovan Broumov,10 : 0 (PK:0:0),Mladé Buky,,zápis uzavřen delegace,2025-10-18,12:30:00,739542,2025-10-18 12:30:00,FC Mladé Buky - TJ Slovan Broumov,False,FC Mladé Buky,V,KP mladšího dorostu U 17,Ml. dorost,Ml_dorost,3,
31.12.2025 14:00,MFK Trutnov,SK Červený Kostelec,-- : -- (PK:0:0),Trutnov - H.S.M.,ODLOŽENO,nezahájen delegace,2025-12-31,14:00:00,739616,2025-12-31 14:00:00,MFK Trutnov - SK Červený Kostelec,False,MFK Trutnov,V,KP mladšího dorostu U 17,Ml. dorost,Ml_dorost,3,ODLOŽENO
05.11.2025 15:00,TJ Baník Žacléř,SK Jičín,-- : -- (PK:0:0),Lampertice,,nezahájen delegace,2025-11-05,15:00:00,739560,2025-11-05 15:00:00,TJ Baník Žacléř - SK Jičín,False,TJ Baník Žacléř,V,KP mladšího dorostu U 17,Ml. dorost,Ml_dorost,3,
26.10.2025 12:00,TJ Slovan Broumov,SK Robousy,0 : 8 (PK:0:0),Broumov,,zápis uzavřen delegace,2025-10-26,12:00:00,739550,2025-10-26 12:00:00,TJ Slovan Broumov - SK Robousy,False,TJ Slovan Broumov,V,KP mladšího dorostu U 17,Ml. dorost,Ml_dorost,3,
26.10.2025 11:00,Lázně Bělohrad/Miletín,FK Jaroměř,0 : 6 (PK:0:0),Lázně Bělohrad,,zápis uzavřen delegace,2025-10-26,11:00:00,739550,2025-10-26 11:00:00,Lázně Bělohrad/Miletín - FK Jaroměř,False,Lázně Bělohrad/Miletín,V,KP mladšího dorostu U 17,Ml. dorost,Ml_dorost,3,
25.10.2025 11:00,SK Česká Skalice,TJ Jiskra Hořice,2 : 3 (PK:0:0),Česká Skalice,,zápis uzavřen delegace,2025-10-25,11:00:00,739549,2025-10-25 11:00:00,SK Česká Skalice - TJ Jiskra Hořice,False,SK Česká Skalice,V,KP mladšího dorostu U 17,Ml. dorost,Ml_dorost,3,
25.10.2025 11:00,Dvůr Králové/Bílá Třemešná,FC Mladé Buky,0 : 7 (PK:0:0),Dvůr Králové,,zápis uzavřen delegace,2025-10-25,11:00:00,739549,2025-10-25 11:00:00,Dvůr Králové/Bílá Třemešná - FC Mladé Buky,True,FC Mladé Buky,D,KP mladšího dorostu U 17,Ml. dorost,Ml_dorost,3,
02.11.2025 10:15,TJ Jiskra Hořice,TJ Baník Žacléř,-- : -- (PK:0:0),Hořice,,nezahájen delegace,2025-11-02,10:15:00,739557,2025-11-02 10:15:00,TJ Jiskra Hořice - TJ Baník Žacléř,False,TJ Jiskra Hořice,V,KP mladšího dorostu U 17,Ml. dorost,Ml_dorost,3,
02.11.2025 10:00,SK Jičín,Lázně Bělohrad/Miletín,-- : -- (PK:0:0),"Jičín, UMT",,nezahájen delegace,2025-11-02,10:00:00,739557,2025-11-02 10:00:00,SK Jičín - Lázně Bělohrad/Miletín,False,SK Jičín,V,KP mladšího dorostu U 17,Ml. dorost,Ml_dorost,3,
02.11.2025 11:30,SK Červený Kostelec,TJ Slovan Broumov,-- : -- (PK:0:0),Červený Kostelec,,nezahájen delegace,2025-11-02,11:30:00,739557,2025-11-02 11:30:00,SK Červený Kostelec - TJ Slovan Broumov,False,SK Červený Kostelec,V,KP mladšího dorostu U 17,Ml. dorost,Ml_dorost,3,
01.11.2025 10:00,Spartak Police n. M.,SK Česká Skalice,-- : -- (PK:0:0),Police n. M.,,nezahájen delegace,2025-11-01,10:00:00,739556,2025-11-01 10:00:00,Spartak Police n. M. - SK Česká Skalice,False,Spartak Police n. M.,V,KP mladšího dorostu U 17,Ml. dorost,Ml_dorost,3,
01.11.2025 11:00,FK Jaroměř,MFK Trutnov,-- : -- (PK:0:0),Jaroměř,,nezahájen delegace,2025-11-01,11:00:00,739556,2025-11-01 11:00:00,FK Jaroměř - MFK Trutnov,False,FK Jaroměř,V,KP mladšího dorostu U 17,Ml. dorost,Ml_dorost,3,
01.11.2025 11:15,SK Robousy,Dvůr Králové/Bílá Třemešná,-- : -- (PK:0:0),Robousy,,nezahájen delegace,2025-11-01,11:15:00,739556,2025-11-01 11:15:00,SK Robousy - Dvůr Králové/Bílá Třemešná,True,SK Robousy,V,KP mladšího dorostu U 17,Ml. dorost,Ml_dorost,3,
09.11.2025 10:00,SK Česká Skalice,TJ Baník Žacléř,-- : -- (PK:0:0),Česká Skalice,,nezahájen delegace,2025-11-09,10:00:00,739564,2025-11-09 10:00:00,SK Česká Skalice - TJ Baník Žacléř,False,SK Česká Skalice,V,KP mladšího dorostu U 17,Ml. dorost,Ml_dorost,3,
09.11.2025 10:15,TJ Jiskra Hořice,MFK Trutnov,-- : -- (PK:0:0),Hořice,,nezahájen delegace,2025-11-09,10:15:00,739564,2025-11-09 10:15:00,TJ Jiskra Hořice - MFK Trutnov,False,TJ Jiskra Hořice,V,KP mladšího dorostu U 17,Ml. dorost,Ml_dorost,3,
09.11.2025 11:30,SK Červený Kostelec,FC Mladé Buky,-- : -- (PK:0:0),Červený Kostelec,,nezahájen delegace,2025-11-09,11:30:00,739564,2025-11-09 11:30:00,SK Červený Kostelec - FC Mladé Buky,False,SK Červený Kostelec,V,KP mladšího dorostu U 17,Ml. dorost,Ml_dorost,3,
09.11.2025 10:30,Spartak Police n. M.,Lázně Bělohrad/Miletín,-- : -- (PK:0:0),Police n. M.,,nezahájen delegace,2025-11-09,10:30:00,739564,2025-11-09 10:30:00,Spartak Police n. M. - Lázně Bělohrad/Miletín,False,Spartak Police n. M.,V,KP mladšího dorostu U 17,Ml. dorost,Ml_dorost,3,
09.11.2025 12:30,SK Jičín,TJ Slovan Broumov,-- : -- (PK:0:0),"Jičín, UMT",,nezahájen delegace,2025-11-09,12:30:00,739564,2025-11-09 12:30:00,SK Jičín - TJ Slovan Broumov,False,SK Jičín,V,KP mladšího dorostu U 17,Ml. dorost,Ml_dorost,3,
08.11.2025 11:00,FK Jaroměř,Dvůr Králové/Bílá Třemešná,-- : -- (PK:0:0),Jaroměř,,nezahájen delegace,2025-11-08,11:00:00,739563,2025-11-08 11:00:00,FK Jaroměř - Dvůr Králové/Bílá Třemešná,True,FK Jaroměř,V,KP mladšího dorostu U 17,Ml. dorost,Ml_dorost,3,
16.11.2025 11:00,TJ Slovan Broumov,FK Jaroměř,-- : -- (PK:0:0),Broumov,,nezahájen delegace,2025-11-16,11:00:00,739571,2025-11-16 11:00:00,TJ Slovan Broumov - FK Jaroměř,False,TJ Slovan Broumov,V,KP mladšího dorostu U 17,Ml. dorost,Ml_dorost,3,
16.11.2025 14:00,Dvůr Králové/Bílá Třemešná,SK Červený Kostelec,-- : -- (PK:0:0),Dvůr Králové,,nezahájen delegace,2025-11-16,14:00:00,739571,2025-11-16 14:00:00,Dvůr Králové/Bílá Třemešná - SK Červený Kostelec,True,SK Červený Kostelec,D,KP mladšího dorostu U 17,Ml. dorost,Ml_dorost,3,
15.11.2025 13:00,TJ Baník Žacléř,Spartak Police n. M.,-- : -- (PK:0:0),Lampertice,,nezahájen delegace,2025-11-15,13:00:00,739570,2025-11-15 13:00:00,TJ Baník Žacléř - Spartak Police n. M.,False,TJ Baník Žacléř,V,KP mladšího dorostu U 17,Ml. dorost,Ml_dorost,3,
15.11.2025 10:00,Lázně Bělohrad/Miletín,TJ Jiskra Hořice,-- : -- (PK:0:0),Lázně Bělohrad,,nezahájen delegace,2025-11-15,10:00:00,739570,2025-11-15 10:00:00,Lázně Bělohrad/Miletín - TJ Jiskra Hořice,False,Lázně Bělohrad/Miletín,V,KP mladšího dorostu U 17,Ml. dorost,Ml_dorost,3,
15.11.2025 12:15,MFK Trutnov,SK Jičín,-- : -- (PK:0:0),"Trutnov, UMT",,nezahájen delegace,2025-11-15,12:15:00,739570,2025-11-15 12:15:00,MFK Trutnov - SK Jičín,False,MFK Trutnov,V,KP mladšího dorostu U 17,Ml. dorost,Ml_dorost,3,
29.10.2025 14:00,FC Mladé Buky,SK Robousy,-- : -- (PK:0:0),Mladé Buky,,nezahájen delegace,2025-10-29,14:00:00,739553,2025-10-29 14:00:00,FC Mladé Buky - SK Robousy,False,FC Mladé Buky,V,KP mladšího dorostu U 17,Ml. dorost,Ml_dorost,3,
31.12.2025 16:30,FK Poříčí u Trutnova,TJ SOKOL Bílá Třemešná,-- : -- (PK:0:0),Poříčí,ODLOŽENO,nezahájen delegace,2025-12-31,16:30:00,739616,2025-12-31 16:30:00,FK Poříčí u Trutnova - TJ SOKOL Bílá Třemešná,True,FK Poříčí u Trutnova,V,OP mladších žáků,Ml. žáci,Ml_zaci,6,ODLOŽENO
31.12.2025 17:30,FK Poříčí u Trutnova,TJ SOKOL Bílá Třemešná,-- : -- (PK:0:0),Poříčí,ODLOŽENO,nezahájen delegace,2025-12-31,17:30:00,739616,2025-12-31 17:30:00,FK Poříčí u Trutnova - TJ SOKOL Bílá Třemešná,True,FK Poříčí u Trutnova,V,OP mladších žáků,Ml. žáci,Ml_zaci,6,ODLOŽENO
27.08.2025 17:00,TJ Jiskra Kocbeře,FK Dolní Kalná,2 : 2 (PK:1:2),Kocbeře,,zápis uzavřen delegace,2025-08-27,17:00:00,739490,2025-08-27 17:00:00,TJ Jiskra Kocbeře - FK Dolní Kalná,False,TJ Jiskra Kocbeře,V,OP mladších žáků,Ml. žáci,Ml_zaci,6,
27.08.2025 18:00,TJ Jiskra Kocbeře,FK Dolní Kalná,2 : 5 (PK:0:0),Kocbeře,,zápis uzavřen delegace,2025-08-27,18:00:00,739490,2025-08-27 18:00:00,TJ Jiskra Kocbeře - FK Dolní Kalná,False,TJ Jiskra Kocbeře,V,OP mladších žáků,Ml. žáci,Ml_zaci,6,
24.08.2025 11:30,TJ Sokol Malé Svatoňovice,Fotbalový klub Mostek,0 : 0 (PK:1:2),M.Svatoňovice,,zápis uzavřen delegace,2025-08-24,11:30:00,739487,2025-08-24 11:30:00,TJ Sokol Malé Svatoňovice - Fotbalový klub Mostek,False,TJ Sokol Malé Svatoňovice,V,OP mladších žáků,Ml. žáci,Ml_zaci,6,
24.08.2025 12:30,TJ Sokol Malé Svatoňovice,Fotbalový klub Mostek,1 : 2 (PK:0:0),M.Svatoňovice,,zápis uzavřen delegace,2025-08-24,12:30:00,739487,2025-08-24 12:30:00,TJ Sokol Malé Svatoňovice - Fotbalový klub Mostek,False,TJ Sokol Malé Svatoňovice,V,OP mladších žáků,Ml. žáci,Ml_zaci,6,
23.08.2025 12:00,Podhůří/Vrchlabí B,TJ Lánov,2 : 2 (PK:2:0),Podhůří,,zápis uzavřen delegace,2025-08-23,12:00:00,739486,2025-08-23 12:00:00,Podhůří/Vrchlabí B - TJ Lánov,False,Podhůří/Vrchlabí B,V,OP mladších žáků,Ml. žáci,Ml_zaci,6,
23.08.2025 11:00,TJ Lánov,Sokol Vítězná,1 : 3 (PK:0:0),Podhůří,,zápis uzavřen delegace,2025-08-23,11:00:00,739486,2025-08-23 11:00:00,TJ Lánov - Sokol Vítězná,False,TJ Lánov,V,OP mladších žáků,Ml. žáci,Ml_zaci,6,
23.08.2025 10:00,Podhůří/Vrchlabí B,Sokol Vítězná,6 : 1 (PK:0:0),Podhůří,,zápis uzavřen delegace,2025-08-23,10:00:00,739486,2025-08-23 10:00:00,Podhůří/Vrchlabí B - Sokol Vítězná,False,Podhůří/Vrchlabí B,V,OP mladších žáků,Ml. žáci,Ml_zaci,6,
23.08.2025 10:00,TJ Lánov,SK Sparta Úpice,0 : 0 (PK:0:0),Lánov,,zápis neuzavřen delegace,2025-08-23,10:00:00,739486,2025-08-23 10:00:00,TJ Lánov - SK Sparta Úpice,False,TJ Lánov,V,OP mladších žáků,Ml. žáci,Ml_zaci,6,
23.08.2025 11:00,TJ Lánov,SK Sparta Úpice,0 : 0 (PK:0:0),Lánov,,zápis neuzavřen delegace,2025-08-23,11:00:00,739486,2025-08-23 11:00:00,TJ Lánov - SK Sparta Úpice,False,TJ Lánov,V,OP mladších žáků,Ml. žáci,Ml_zaci,6,
23.08.2025 14:00,TJ Spartak Pilníkov,Sportovní klub MFC Svoboda,3 : 2 (PK:0:0),Pilníkov,,zápis uzavřen delegace,2025-08-23,14:00:00,739486,2025-08-23 14:00:00,TJ Spartak Pilníkov - Sportovní klub MFC Svoboda,False,TJ Spartak Pilníkov,V,OP mladších žáků,Ml. žáci,Ml_zaci,6,
23.08.2025 15:00,TJ Spartak Pilníkov,Sportovní klub MFC Svoboda,1 : 2 (PK:0:0),Pilníkov,,zápis uzavřen delegace,2025-08-23,15:00:00,739486,2025-08-23 15:00:00,TJ Spartak Pilníkov - Sportovní klub MFC Svoboda,False,TJ Spartak Pilníkov,V,OP mladších žáků,Ml. žáci,Ml_zaci,6,
31.08.2025 11:00,TJ Lánov,FK Poříčí u Trutnova,1 : 0 (PK:0:0),Lánov,,zápis uzavřen delegace,2025-08-31,11:00:00,739494,2025-08-31 11:00:00,TJ Lánov - FK Poříčí u Trutnova,False,TJ Lánov,V,OP mladších žáků,Ml. žáci,Ml_zaci,6,
31.08.2025 10:00,TJ Lánov,FK Poříčí u Trutnova,3 : 0 (PK:0:0),Lánov,,zápis uzavřen delegace,2025-08-31,10:00:00,739494,2025-08-31 10:00:00,TJ Lánov - FK Poříčí u Trutnova,False,TJ Lánov,V,OP mladších žáků,Ml. žáci,Ml_zaci,6,
31.08.2025 10:00,Fotbalový klub Mostek,TJ Jiskra Kocbeře,5 : 2 (PK:0:0),Mostek,,zápis uzavřen delegace,2025-08-31,10:00:00,739494,2025-08-31 10:00:00,Fotbalový klub Mostek - TJ Jiskra Kocbeře,False,Fotbalový klub Mostek,V,OP mladších žáků,Ml. žáci,Ml_zaci,6,
31.08.2025 11:00,Fotbalový klub Mostek,TJ Jiskra Kocbeře,1 : 3 (PK:0:0),Mostek,,zápis uzavřen delegace,2025-08-31,11:00:00,739494,2025-08-31 11:00:00,Fotbalový klub Mostek - TJ Jiskra Kocbeře,False,Fotbalový klub Mostek,V,OP mladších žáků,Ml. žáci,Ml_zaci,6,
30.08.2025 09:00,SK Sparta Úpice,FK Dolní Kalná,0 : 0 (PK:0:0),Úpice,,zápis neuzavřen delegace,2025-08-30,09:00:00,739493,2025-08-30 09:00:00,SK Sparta Úpice - FK Dolní Kalná,False,SK Sparta Úpice,V,OP mladších žáků,Ml. žáci,Ml_zaci,6,
30.08.2025 11:00,FK Dolní Kalná,Podhůří/Vrchlabí B,5 : 0 (PK:0:0),Svoboda,,zápis uzavřen delegace,2025-08-30,11:00:00,739493,2025-08-30 11:00:00,FK Dolní Kalná - Podhůří/Vrchlabí B,False,FK Dolní Kalná,V,OP mladších žáků,Ml. žáci,Ml_zaci,6,
30.08.2025 10:00,Sportovní klub MFC Svoboda,Podhůří/Vrchlabí B,2 : 7 (PK:0:0),Svoboda,,zápis uzavřen delegace,2025-08-30,10:00:00,739493,2025-08-30 10:00:00,Sportovní klub MFC Svoboda - Podhůří/Vrchlabí B,False,Sportovní klub MFC Svoboda,V,OP mladších žáků,Ml. žáci,Ml_zaci,6,
30.08.2025 10:00,TJ SOKOL Bílá Třemešná,TJ Spartak Pilníkov,0 : 1 (PK:0:0),B.Třemešná,,zápis uzavřen delegace,2025-08-30,10:00:00,739493,2025-08-30 10:00:00,TJ SOKOL Bílá Třemešná - TJ Spartak Pilníkov,True,TJ Spartak Pilníkov,D,OP mladších žáků,Ml. žáci,Ml_zaci,6,
30.08.2025 10:00,SK Sparta Úpice,FK Dolní Kalná,0 : 0 (PK:0:0),Úpice,,zápis neuzavřen delegace,2025-08-30,10:00:00,739493,2025-08-30 10:00:00,SK Sparta Úpice - FK Dolní Kalná,False,SK Sparta Úpice,V,OP mladších žáků,Ml. žáci,Ml_zaci,6,
30.08.2025 14:00,Sokol Vítězná,TJ Sokol Malé Svatoňovice,0 : 2 (PK:0:0),Vítězná,,zápis uzavřen delegace,2025-08-30,14:00:00,739493,2025-08-30 14:00:00,Sokol Vítězná - TJ Sokol Malé Svatoňovice,False,Sokol Vítězná,V,OP mladších žáků,Ml. žáci,Ml_zaci,6,
30.08.2025 13:00,Sokol Vítězná,TJ Sokol Malé Svatoňovice,0 : 1 (PK:0:0),Vítězná,,zápis uzavřen delegace,2025-08-30,13:00:00,739493,2025-08-30 13:00:00,Sokol Vítězná - TJ Sokol Malé Svatoňovice,False,Sokol Vítězná,V,OP mladších žáků,Ml. žáci,Ml_zaci,6,
30.08.2025 12:00,Sportovní klub MFC Svoboda,FK Dolní Kalná,0 : 9 (PK:0:0),Svoboda,,zápis uzavřen delegace,2025-08-30,12:00:00,739493,2025-08-30 12:00:00,Sportovní klub MFC Svoboda - FK Dolní Kalná,False,Sportovní klub MFC Svoboda,V,OP mladších žáků,Ml. žáci,Ml_zaci,6,
30.08.2025 11:00,TJ SOKOL Bílá Třemešná,TJ Spartak Pilníkov,2 : 3 (PK:0:0),B.Třemešná,,zápis uzavřen delegace,2025-08-30,11:00:00,739493,2025-08-30 11:00:00,TJ SOKOL Bílá Třemešná - TJ Spartak Pilníkov,True,TJ Spartak Pilníkov,D,OP mladších žáků,Ml. žáci,Ml_zaci,6,
03.09.2025 16:45,TJ Spartak Pilníkov,Fotbalový klub Mostek,1 : 6 (PK:0:0),Pilníkov,,zápis uzavřen delegace,2025-09-03,16:45:00,739497,2025-09-03 16:45:00,TJ Spartak Pilníkov - Fotbalový klub Mostek,False,TJ Spartak Pilníkov,V,OP mladších žáků,Ml. žáci,Ml_zaci,6,
03.09.2025 17:00,TJ SOKOL Bílá Třemešná,SK Sparta Úpice,0 : 0 (PK:0:0),B.Třemešná,,zápis neuzavřen delegace,2025-09-03,17:00:00,739497,2025-09-03 17:00:00,TJ SOKOL Bílá Třemešná - SK Sparta Úpice,True,SK Sparta Úpice,D,OP mladších žáků,Ml. žáci,Ml_zaci,6,
03.09.2025 17:00,TJ Lánov,Sportovní klub MFC Svoboda,2 : 1 (PK:0:0),Lánov,,zápis uzavřen delegace,2025-09-03,17:00:00,739497,2025-09-03 17:00:00,TJ Lánov - Sportovní klub MFC Svoboda,False,TJ Lánov,V,OP mladších žáků,Ml. žáci,Ml_zaci,6,
03.09.2025 17:00,Podhůří/Vrchlabí B,FK Dolní Kalná,4 : 3 (PK:0:0),Podhůří,,zápis uzavřen delegace,2025-09-03,17:00:00,739497,2025-09-03 17:00:00,Podhůří/Vrchlabí B - FK Dolní Kalná,False,Podhůří/Vrchlabí B,V,OP mladších žáků,Ml. žáci,Ml_zaci,6,
03.09.2025 17:00,FK Poříčí u Trutnova,Sokol Vítězná,1 : 2 (PK:0:0),Poříčí,,zápis uzavřen delegace,2025-09-03,17:00:00,739497,2025-09-03 17:00:00,FK Poříčí u Trutnova - Sokol Vítězná,False,FK Poříčí u Trutnova,V,OP mladších žáků,Ml. žáci,Ml_zaci,6,
03.09.2025 17:00,TJ Sokol Malé Svatoňovice,TJ Jiskra Kocbeře,2 : 0 (PK:0:0),M.Svatoňovice,,zápis uzavřen delegace,2025-09-03,17:00:00,739497,2025-09-03 17:00:00,TJ Sokol Malé Svatoňovice - TJ Jiskra Kocbeře,False,TJ Sokol Malé Svatoňovice,V,OP mladších žáků,Ml. žáci,Ml_zaci,6,
03.09.2025 17:45,TJ SOKOL Bílá Třemešná,Fotbalový klub Mostek,3 : 0 (PK:0:0),Pilníkov,,zápis uzavřen delegace,2025-09-03,17:45:00,739497,2025-09-03 17:45:00,TJ SOKOL Bílá Třemešná - Fotbalový klub Mostek,True,Fotbalový klub Mostek,D,OP mladších žáků,Ml. žáci,Ml_zaci,6,
03.09.2025 18:00,TJ SOKOL Bílá Třemešná,SK Sparta Úpice,0 : 0 (PK:0:0),B.Třemešná,,zápis neuzavřen delegace,2025-09-03,18:00:00,739497,2025-09-03 18:00:00,TJ SOKOL Bílá Třemešná - SK Sparta Úpice,True,SK Sparta Úpice,D,OP mladších žáků,Ml. žáci,Ml_zaci,6,
03.09.2025 18:00,FK Poříčí u Trutnova,Sokol Vítězná,0 : 2 (PK:0:0),Poříčí,,zápis uzavřen delegace,2025-09-03,18:00:00,739497,2025-09-03 18:00:00,FK Poříčí u Trutnova - Sokol Vítězná,False,FK Poříčí u Trutnova,V,OP mladších žáků,Ml. žáci,Ml_zaci,6,
03.09.2025 18:00,Podhůří/Vrchlabí B,FK Dolní Kalná,3 : 2 (PK:0:0),Podhůří,,zápis uzavřen delegace,2025-09-03,18:00:00,739497,2025-09-03 18:00:00,Podhůří/Vrchlabí B - FK Dolní Kalná,False,Podhůří/Vrchlabí B,V,OP mladších žáků,Ml. žáci,Ml_zaci,6,
03.09.2025 18:00,TJ Lánov,Sportovní klub MFC Svoboda,3 : 1 (PK:0:0),Lánov,,zápis uzavřen delegace,2025-09-03,18:00:00,739497,2025-09-03 18:00:00,TJ Lánov - Sportovní klub MFC Svoboda,False,TJ Lánov,V,OP mladších žáků,Ml. žáci,Ml_zaci,6,
03.09.2025 18:00,TJ Sokol Malé Svatoňovice,TJ Jiskra Kocbeře,2 : 0 (PK:0:0),M.Svatoňovice,,zápis uzavřen delegace,2025-09-03,18:00:00,739497,2025-09-03 18:00:00,TJ Sokol Malé Svatoňovice - TJ Jiskra Kocbeře,False,TJ Sokol Malé Svatoňovice,V,OP mladších žáků,Ml. žáci,Ml_zaci,6,
03.09.2025 18:45,TJ Spartak Pilníkov,TJ SOKOL Bílá Třemešná,0 : 2 (PK:0:0),Pilníkov,,zápis uzavřen delegace,2025-09-03,18:45:00,739497,2025-09-03 18:45:00,TJ Spartak Pilníkov - TJ SOKOL Bílá Třemešná,True,TJ Spartak Pilníkov,V,OP mladších žáků,Ml. žáci,Ml_zaci,6,
07.09.2025 15:30,FK Dolní Kalná,Fotbalový klub Mostek,6 : 3 (PK:0:0),Dolní Kalná,,zápis uzavřen delegace,2025-09-07,15:30:00,739501,2025-09-07 15:30:00,FK Dolní Kalná - Fotbalový klub Mostek,False,FK Dolní Kalná,V,OP mladších žáků,Ml. žáci,Ml_zaci,6,
07.09.2025 11:30,TJ Sokol Malé Svatoňovice,Sportovní klub MFC Svoboda,3 : 1 (PK:0:0),M.Svatoňovice,,zápis uzavřen delegace,2025-09-07,11:30:00,739501,2025-09-07 11:30:00,TJ Sokol Malé Svatoňovice - Sportovní klub MFC Svoboda,False,TJ Sokol Malé Svatoňovice,V,OP mladších žáků,Ml. žáci,Ml_zaci,6,
07.09.2025 12:30,TJ Sokol Malé Svatoňovice,Sportovní klub MFC Svoboda,5 : 0 (PK:0:0),M.Svatoňovice,,zápis uzavřen delegace,2025-09-07,12:30:00,739501,2025-09-07 12:30:00,TJ Sokol Malé Svatoňovice - Sportovní klub MFC Svoboda,False,TJ Sokol Malé Svatoňovice,V,OP mladších žáků,Ml. žáci,Ml_zaci,6,
07.09.2025 14:30,FK Dolní Kalná,Fotbalový klub Mostek,4 : 1 (PK:0:0),Dolní Kalná,,zápis uzavřen delegace,2025-09-07,14:30:00,739501,2025-09-07 14:30:00,FK Dolní Kalná - Fotbalový klub Mostek,False,FK Dolní Kalná,V,OP mladších žáků,Ml. žáci,Ml_zaci,6,
06.09.2025 10:00,TJ Jiskra Kocbeře,Sokol Vítězná,0 : 0 (PK:3:2),Kocbeře,,zápis uzavřen delegace,2025-09-06,10:00:00,739500,2025-09-06 10:00:00,TJ Jiskra Kocbeře - Sokol Vítězná,False,TJ Jiskra Kocbeře,V,OP mladších žáků,Ml. žáci,Ml_zaci,6,
06.09.2025 11:00,Podhůří/Vrchlabí B,TJ SOKOL Bílá Třemešná,4 : 1 (PK:0:0),Podhůří,,zápis uzavřen delegace,2025-09-06,11:00:00,739500,2025-09-06 11:00:00,Podhůří/Vrchlabí B - TJ SOKOL Bílá Třemešná,True,Podhůří/Vrchlabí B,V,OP mladších žáků,Ml. žáci,Ml_zaci,6,
06.09.2025 11:00,FK Poříčí u Trutnova,SK Sparta Úpice,0 : 0 (PK:0:0),Poříčí,,zápis neuzavřen delegace,2025-09-06,11:00:00,739500,2025-09-06 11:00:00,FK Poříčí u Trutnova - SK Sparta Úpice,False,FK Poříčí u Trutnova,V,OP mladších žáků,Ml. žáci,Ml_zaci,6,
06.09.2025 10:00,FK Poříčí u Trutnova,SK Sparta Úpice,0 : 0 (PK:0:0),Poříčí,,zápis neuzavřen delegace,2025-09-06,10:00:00,739500,2025-09-06 10:00:00,FK Poříčí u Trutnova - SK Sparta Úpice,False,FK Poříčí u Trutnova,V,OP mladších žáků,Ml. žáci,Ml_zaci,6,
06.09.2025 10:00,Podhůří/Vrchlabí B,TJ SOKOL Bílá Třemešná,4 : 1 (PK:0:0),Podhůří,,zápis uzavřen delegace,2025-09-06,10:00:00,739500,2025-09-06 10:00:00,Podhůří/Vrchlabí B - TJ SOKOL Bílá Třemešná,True,Podhůří/Vrchlabí B,V,OP mladších žáků,Ml. žáci,Ml_zaci,6,
06.09.2025 15:00,TJ Spartak Pilníkov,FK Poříčí u Trutnova,1 : 2 (PK:0:0),Pilníkov,,zápis uzavřen delegace,2025-09-06,15:00:00,739500,2025-09-06 15:00:00,TJ Spartak Pilníkov - FK Poříčí u Trutnova,False,TJ Spartak Pilníkov,V,OP mladších žáků,Ml. žáci,Ml_zaci,6,
06.09.2025 14:00,FK Poříčí u Trutnova,TJ Lánov,1 : 3 (PK:0:0),Pilníkov,,zápis uzavřen delegace,2025-09-06,14:00:00,739500,2025-09-06 14:00:00,FK Poříčí u Trutnova - TJ Lánov,False,FK Poříčí u Trutnova,V,OP mladších žáků,Ml. žáci,Ml_zaci,6,
06.09.2025 13:00,TJ Spartak Pilníkov,TJ Lánov,2 : 0 (PK:0:0),Pilníkov,,zápis uzavřen delegace,2025-09-06,13:00:00,739500,2025-09-06 13:00:00,TJ Spartak Pilníkov - TJ Lánov,False,TJ Spartak Pilníkov,V,OP mladších žáků,Ml. žáci,Ml_zaci,6,
06.09.2025 11:00,TJ Jiskra Kocbeře,Sokol Vítězná,0 : 2 (PK:0:0),Kocbeře,,zápis uzavřen delegace,2025-09-06,11:00:00,739500,2025-09-06 11:00:00,TJ Jiskra Kocbeře - Sokol Vítězná,False,TJ Jiskra Kocbeře,V,OP mladších žáků,Ml. žáci,Ml_zaci,6,
02.10.2025 16:45,Sokol Vítězná,FK Dolní Kalná,0 : 5 (PK:0:0),Vítězná,"ODLOŽENO, Původní termín: 25.09.2025 17:15",zápis uzavřen delegace,2025-10-02,16:45:00,739526,2025-10-02 16:45:00,Sokol Vítězná - FK Dolní Kalná,False,Sokol Vítězná,V,OP mladších žáků,Ml. žáci,Ml_zaci,6,ODLOŽENO Původní termín: 25.09.2025 17:15
02.10.2025 17:45,Sokol Vítězná,FK Dolní Kalná,0 : 4 (PK:0:0),Vítězná,"ODLOŽENO, Původní termín: 25.09.2025 18:15",zápis uzavřen delegace,2025-10-02,17:45:00,739526,2025-10-02 17:45:00,Sokol Vítězná - FK Dolní Kalná,False,Sokol Vítězná,V,OP mladších žáků,Ml. žáci,Ml_zaci,6,ODLOŽENO Původní termín: 25.09.2025 18:15
13.09.2025 10:00,TJ SOKOL Bílá Třemešná,TJ Sokol Malé Svatoňovice,1 : 3 (PK:0:0),B.Třemešná,,zápis uzavřen delegace,2025-09-13,10:00:00,739507,2025-09-13 10:00:00,TJ SOKOL Bílá Třemešná - TJ Sokol Malé Svatoňovice,True,TJ Sokol Malé Svatoňovice,D,OP mladších žáků,Ml. žáci,Ml_zaci,6,
13.09.2025 10:00,SK Sparta Úpice,Fotbalový klub Mostek,0 : 0 (PK:0:0),Úpice,,zápis neuzavřen delegace,2025-09-13,10:00:00,739507,2025-09-13 10:00:00,SK Sparta Úpice - Fotbalový klub Mostek,False,SK Sparta Úpice,V,OP mladších žáků,Ml. žáci,Ml_zaci,6,
13.09.2025 09:00,SK Sparta Úpice,Fotbalový klub Mostek,0 : 0 (PK:0:0),Úpice,,zápis neuzavřen delegace,2025-09-13,09:00:00,739507,2025-09-13 09:00:00,SK Sparta Úpice - Fotbalový klub Mostek,False,SK Sparta Úpice,V,OP mladších žáků,Ml. žáci,Ml_zaci,6,
13.09.2025 10:00,FK Poříčí u Trutnova,TJ Spartak Pilníkov,3 : 2 (PK:0:0),Poříčí,,zápis uzavřen delegace,2025-09-13,10:00:00,739507,2025-09-13 10:00:00,FK Poříčí u Trutnova - TJ Spartak Pilníkov,False,FK Poříčí u Trutnova,V,OP mladších žáků,Ml. žáci,Ml_zaci,6,
13.09.2025 10:00,TJ Lánov,Podhůří/Vrchlabí B,1 : 3 (PK:0:0),Lánov,,zápis uzavřen delegace,2025-09-13,10:00:00,739507,2025-09-13 10:00:00,TJ Lánov - Podhůří/Vrchlabí B,False,TJ Lánov,V,OP mladších žáků,Ml. žáci,Ml_zaci,6,
13.09.2025 10:00,Sportovní klub MFC Svoboda,TJ Jiskra Kocbeře,0 : 1 (PK:0:0),Svoboda,,zápis uzavřen delegace,2025-09-13,10:00:00,739507,2025-09-13 10:00:00,Sportovní klub MFC Svoboda - TJ Jiskra Kocbeře,False,Sportovní klub MFC Svoboda,V,OP mladších žáků,Ml. žáci,Ml_zaci,6,
13.09.2025 11:00,FK Poříčí u Trutnova,TJ Spartak Pilníkov,1 : 0 (PK:0:0),Poříčí,,zápis uzavřen delegace,2025-09-13,11:00:00,739507,2025-09-13 11:00:00,FK Poříčí u Trutnova - TJ Spartak Pilníkov,False,FK Poříčí u Trutnova,V,OP mladších žáků,Ml. žáci,Ml_zaci,6,
13.09.2025 11:00,TJ SOKOL Bílá Třemešná,TJ Sokol Malé Svatoňovice,2 : 0 (PK:0:0),B.Třemešná,,zápis uzavřen delegace,2025-09-13,11:00:00,739507,2025-09-13 11:00:00,TJ SOKOL Bílá Třemešná - TJ Sokol Malé Svatoňovice,True,TJ Sokol Malé Svatoňovice,D,OP mladších žáků,Ml. žáci,Ml_zaci,6,
13.09.2025 11:00,Fotbalový klub Mostek,Podhůří/Vrchlabí B,1 : 5 (PK:0:0),Lánov,,zápis uzavřen delegace,2025-09-13,11:00:00,739507,2025-09-13 11:00:00,Fotbalový klub Mostek - Podhůří/Vrchlabí B,False,Fotbalový klub Mostek,V,OP mladších žáků,Ml. žáci,Ml_zaci,6,
13.09.2025 12:00,TJ Lánov,Fotbalový klub Mostek,1 : 2 (PK:0:0),Lánov,,zápis uzavřen delegace,2025-09-13,12:00:00,739507,2025-09-13 12:00:00,TJ Lánov - Fotbalový klub Mostek,False,TJ Lánov,V,OP mladších žáků,Ml. žáci,Ml_zaci,6,
13.09.2025 11:00,Sportovní klub MFC Svoboda,TJ Jiskra Kocbeře,1 : 1 (PK:2:1),Svoboda,,zápis uzavřen delegace,2025-09-13,11:00:00,739507,2025-09-13 11:00:00,Sportovní klub MFC Svoboda - TJ Jiskra Kocbeře,False,Sportovní klub MFC Svoboda,V,OP mladších žáků,Ml. žáci,Ml_zaci,6,
17.09.2025 16:15,Fotbalový klub Mostek,TJ Jiskra Kocbeře,4 : 3 (PK:0:0),Mostek,,zápis uzavřen delegace,2025-09-17,16:15:00,739511,2025-09-17 16:15:00,Fotbalový klub Mostek - TJ Jiskra Kocbeře,False,Fotbalový klub Mostek,V,OP mladších žáků,Ml. žáci,Ml_zaci,6,
17.09.2025 17:00,FK Dolní Kalná,TJ Sokol Malé Svatoňovice,0 : 0 (PK:3:4),Dolní Kalná,,zápis uzavřen delegace,2025-09-17,17:00:00,739511,2025-09-17 17:00:00,FK Dolní Kalná - TJ Sokol Malé Svatoňovice,False,FK Dolní Kalná,V,OP mladších žáků,Ml. žáci,Ml_zaci,6,
17.09.2025 17:00,Sportovní klub MFC Svoboda,FK Poříčí u Trutnova,3 : 1 (PK:0:0),Svoboda,,zápis uzavřen delegace,2025-09-17,17:00:00,739511,2025-09-17 17:00:00,Sportovní klub MFC Svoboda - FK Poříčí u Trutnova,False,Sportovní klub MFC Svoboda,V,OP mladších žáků,Ml. žáci,Ml_zaci,6,
17.09.2025 17:00,SK Sparta Úpice,TJ Jiskra Kocbeře,0 : 0 (PK:0:0),Úpice,,zápis neuzavřen delegace,2025-09-17,17:00:00,739511,2025-09-17 17:00:00,SK Sparta Úpice - TJ Jiskra Kocbeře,False,SK Sparta Úpice,V,OP mladších žáků,Ml. žáci,Ml_zaci,6,
17.09.2025 17:00,TJ SOKOL Bílá Třemešná,TJ Lánov,0 : 1 (PK:0:0),B.Třemešná,,zápis uzavřen delegace,2025-09-17,17:00:00,739511,2025-09-17 17:00:00,TJ SOKOL Bílá Třemešná - TJ Lánov,True,TJ Lánov,D,OP mladších žáků,Ml. žáci,Ml_zaci,6,
17.09.2025 18:00,TJ SOKOL Bílá Třemešná,TJ Lánov,1 : 1 (PK:3:2),B.Třemešná,,zápis uzavřen delegace,2025-09-17,18:00:00,739511,2025-09-17 18:00:00,TJ SOKOL Bílá Třemešná - TJ Lánov,True,TJ Lánov,D,OP mladších žáků,Ml. žáci,Ml_zaci,6,
17.09.2025 18:00,FK Dolní Kalná,TJ Sokol Malé Svatoňovice,0 : 4 (PK:0:0),Dolní Kalná,,zápis uzavřen delegace,2025-09-17,18:00:00,739511,2025-09-17 18:00:00,FK Dolní Kalná - TJ Sokol Malé Svatoňovice,False,FK Dolní Kalná,V,OP mladších žáků,Ml. žáci,Ml_zaci,6,
17.09.2025 17:15,TJ Jiskra Kocbeře,Podhůří/Vrchlabí B,3 : 6 (PK:0:0),Mostek,,zápis uzavřen delegace,2025-09-17,17:15:00,739511,2025-09-17 17:15:00,TJ Jiskra Kocbeře - Podhůří/Vrchlabí B,False,TJ Jiskra Kocbeře,V,OP mladších žáků,Ml. žáci,Ml_zaci,6,
17.09.2025 18:00,SK Sparta Úpice,TJ Jiskra Kocbeře,0 : 0 (PK:0:0),Úpice,,zápis neuzavřen delegace,2025-09-17,18:00:00,739511,2025-09-17 18:00:00,SK Sparta Úpice - TJ Jiskra Kocbeře,False,SK Sparta Úpice,V,OP mladších žáků,Ml. žáci,Ml_zaci,6,
17.09.2025 18:00,Sportovní klub MFC Svoboda,FK Poříčí u Trutnova,4 : 1 (PK:0:0),Svoboda,,zápis uzavřen delegace,2025-09-17,18:00:00,739511,2025-09-17 18:00:00,Sportovní klub MFC Svoboda - FK Poříčí u Trutnova,False,Sportovní klub MFC Svoboda,V,OP mladších žáků,Ml. žáci,Ml_zaci,6,
17.09.2025 18:15,Fotbalový klub Mostek,Podhůří/Vrchlabí B,2 : 4 (PK:0:0),Mostek,,zápis uzavřen delegace,2025-09-17,18:15:00,739511,2025-09-17 18:15:00,Fotbalový klub Mostek - Podhůří/Vrchlabí B,False,Fotbalový klub Mostek,V,OP mladších žáků,Ml. žáci,Ml_zaci,6,
16.09.2025 18:00,Sokol Vítězná,TJ Spartak Pilníkov,2 : 1 (PK:0:0),Vítězná,", Původní termín: 17.09.2025 18:00",zápis uzavřen delegace,2025-09-16,18:00:00,739510,2025-09-16 18:00:00,Sokol Vítězná - TJ Spartak Pilníkov,False,Sokol Vítězná,V,OP mladších žáků,Ml. žáci,Ml_zaci,6, Původní termín: 17.09.2025 18:00
16.09.2025 17:00,Sokol Vítězná,TJ Spartak Pilníkov,2 : 0 (PK:0:0),Vítězná,"/ , Původní termín: 17.09.2025 17:00",zápis uzavřen delegace,2025-09-16,17:00:00,739510,2025-09-16 17:00:00,Sokol Vítězná - TJ Spartak Pilníkov,False,Sokol Vítězná,V,OP mladších žáků,Ml. žáci,Ml_zaci,6,  Původní termín: 17.09.2025 17:00
28.09.2025 11:00,FK Poříčí u Trutnova,TJ Sokol Malé Svatoňovice,1 : 1 (PK:2:0),Poříčí,,zápis uzavřen delegace,2025-09-28,11:00:00,739522,2025-09-28 11:00:00,FK Poříčí u Trutnova - TJ Sokol Malé Svatoňovice,False,FK Poříčí u Trutnova,V,OP mladších žáků,Ml. žáci,Ml_zaci,6,
28.09.2025 11:15,TJ Lánov,TJ Jiskra Kocbeře,3 : 2 (PK:0:0),Lánov,,zápis uzavřen delegace,2025-09-28,11:15:00,739522,2025-09-28 11:15:00,TJ Lánov - TJ Jiskra Kocbeře,False,TJ Lánov,V,OP mladších žáků,Ml. žáci,Ml_zaci,6,
28.09.2025 12:15,TJ Lánov,TJ Jiskra Kocbeře,6 : 1 (PK:0:0),Lánov,,zápis uzavřen delegace,2025-09-28,12:15:00,739522,2025-09-28 12:15:00,TJ Lánov - TJ Jiskra Kocbeře,False,TJ Lánov,V,OP mladších žáků,Ml. žáci,Ml_zaci,6,
28.09.2025 10:00,FK Poříčí u Trutnova,TJ Sokol Malé Svatoňovice,1 : 3 (PK:0:0),Poříčí,,zápis uzavřen delegace,2025-09-28,10:00:00,739522,2025-09-28 10:00:00,FK Poříčí u Trutnova - TJ Sokol Malé Svatoňovice,False,FK Poříčí u Trutnova,V,OP mladších žáků,Ml. žáci,Ml_zaci,6,
27.09.2025 11:00,TJ SOKOL Bílá Třemešná,FK Dolní Kalná,0 : 0 (PK:3:2),B.Třemešná,,zápis uzavřen delegace,2025-09-27,11:00:00,739521,2025-09-27 11:00:00,TJ SOKOL Bílá Třemešná - FK Dolní Kalná,True,FK Dolní Kalná,D,OP mladších žáků,Ml. žáci,Ml_zaci,6,
27.09.2025 10:00,Sportovní klub MFC Svoboda,Fotbalový klub Mostek,0 : 0 (PK:0:2),Svoboda,,zápis uzavřen delegace,2025-09-27,10:00:00,739521,2025-09-27 10:00:00,Sportovní klub MFC Svoboda - Fotbalový klub Mostek,False,Sportovní klub MFC Svoboda,V,OP mladších žáků,Ml. žáci,Ml_zaci,6,
27.09.2025 10:00,TJ SOKOL Bílá Třemešná,FK Dolní Kalná,1 : 4 (PK:0:0),B.Třemešná,,zápis uzavřen delegace,2025-09-27,10:00:00,739521,2025-09-27 10:00:00,TJ SOKOL Bílá Třemešná - FK Dolní Kalná,True,FK Dolní Kalná,D,OP mladších žáků,Ml. žáci,Ml_zaci,6,
27.09.2025 14:30,TJ Spartak Pilníkov,Podhůří/Vrchlabí B,1 : 3 (PK:0:0),Pilníkov,,zápis uzavřen delegace,2025-09-27,14:30:00,739521,2025-09-27 14:30:00,TJ Spartak Pilníkov - Podhůří/Vrchlabí B,False,TJ Spartak Pilníkov,V,OP mladších žáků,Ml. žáci,Ml_zaci,6,
27.09.2025 13:30,TJ Spartak Pilníkov,Podhůří/Vrchlabí B,1 : 3 (PK:0:0),Pilníkov,,zápis uzavřen delegace,2025-09-27,13:30:00,739521,2025-09-27 13:30:00,TJ Spartak Pilníkov - Podhůří/Vrchlabí B,False,TJ Spartak Pilníkov,V,OP mladších žáků,Ml. žáci,Ml_zaci,6,
27.09.2025 12:00,Sportovní klub MFC Svoboda,Sokol Vítězná,1 : 3 (PK:0:0),Svoboda,,zápis uzavřen delegace,2025-09-27,12:00:00,739521,2025-09-27 12:00:00,Sportovní klub MFC Svoboda - Sokol Vítězná,False,Sportovní klub MFC Svoboda,V,OP mladších žáků,Ml. žáci,Ml_zaci,6,
27.09.2025 11:00,Sokol Vítězná,Fotbalový klub Mostek,0 : 5 (PK:0:0),Svoboda,,zápis uzavřen delegace,2025-09-27,11:00:00,739521,2025-09-27 11:00:00,Sokol Vítězná - Fotbalový klub Mostek,False,Sokol Vítězná,V,OP mladších žáků,Ml. žáci,Ml_zaci,6,
05.10.2025 10:45,TJ Sokol Malé Svatoňovice,TJ Spartak Pilníkov,3 : 0 (PK:0:0),M.Svatoňovice,,zápis uzavřen delegace,2025-10-05,10:45:00,739529,2025-10-05 10:45:00,TJ Sokol Malé Svatoňovice - TJ Spartak Pilníkov,False,TJ Sokol Malé Svatoňovice,V,OP mladších žáků,Ml. žáci,Ml_zaci,6,
05.10.2025 11:00,Sokol Vítězná,Sportovní klub MFC Svoboda,3 : 2 (PK:0:0),Vítězná,", Původní termín: 04.10.2025 14:00",zápis uzavřen delegace,2025-10-05,11:00:00,739529,2025-10-05 11:00:00,Sokol Vítězná - Sportovní klub MFC Svoboda,False,Sokol Vítězná,V,OP mladších žáků,Ml. žáci,Ml_zaci,6, Původní termín: 04.10.2025 14:00
05.10.2025 11:45,TJ Sokol Malé Svatoňovice,TJ Spartak Pilníkov,5 : 0 (PK:0:0),M.Svatoňovice,,zápis uzavřen delegace,2025-10-05,11:45:00,739529,2025-10-05 11:45:00,TJ Sokol Malé Svatoňovice - TJ Spartak Pilníkov,False,TJ Sokol Malé Svatoňovice,V,OP mladších žáků,Ml. žáci,Ml_zaci,6,
05.10.2025 10:00,Sokol Vítězná,Sportovní klub MFC Svoboda,0 : 1 (PK:0:0),Vítězná,", Původní termín: 04.10.2025 13:00",zápis uzavřen delegace,2025-10-05,10:00:00,739529,2025-10-05 10:00:00,Sokol Vítězná - Sportovní klub MFC Svoboda,False,Sokol Vítězná,V,OP mladších žáků,Ml. žáci,Ml_zaci,6, Původní termín: 04.10.2025 13:00
04.10.2025 10:00,TJ Jiskra Kocbeře,FK Poříčí u Trutnova,1 : 1 (PK:1:3),Kocbeře,,zápis uzavřen delegace,2025-10-04,10:00:00,739528,2025-10-04 10:00:00,TJ Jiskra Kocbeře - FK Poříčí u Trutnova,False,TJ Jiskra Kocbeře,V,OP mladších žáků,Ml. žáci,Ml_zaci,6,
04.10.2025 09:00,Fotbalový klub Mostek,TJ SOKOL Bílá Třemešná,0 : 2 (PK:0:0),Mostek,,zápis uzavřen delegace,2025-10-04,09:00:00,739528,2025-10-04 09:00:00,Fotbalový klub Mostek - TJ SOKOL Bílá Třemešná,True,Fotbalový klub Mostek,V,OP mladších žáků,Ml. žáci,Ml_zaci,6,
04.10.2025 10:00,Podhůří/Vrchlabí B,TJ SOKOL Bílá Třemešná,5 : 1 (PK:0:0),Mostek,,zápis uzavřen delegace,2025-10-04,10:00:00,739528,2025-10-04 10:00:00,Podhůří/Vrchlabí B - TJ SOKOL Bílá Třemešná,True,Podhůří/Vrchlabí B,V,OP mladších žáků,Ml. žáci,Ml_zaci,6,
04.10.2025 14:30,FK Dolní Kalná,TJ Lánov,4 : 1 (PK:0:0),Dolní Kalná,,zápis uzavřen delegace,2025-10-04,14:30:00,739528,2025-10-04 14:30:00,FK Dolní Kalná - TJ Lánov,False,FK Dolní Kalná,V,OP mladších žáků,Ml. žáci,Ml_zaci,6,
04.10.2025 13:30,FK Dolní Kalná,TJ Lánov,5 : 2 (PK:0:0),Dolní Kalná,,zápis uzavřen delegace,2025-10-04,13:30:00,739528,2025-10-04 13:30:00,FK Dolní Kalná - TJ Lánov,False,FK Dolní Kalná,V,OP mladších žáků,Ml. žáci,Ml_zaci,6,
04.10.2025 11:00,Fotbalový klub Mostek,Podhůří/Vrchlabí B,1 : 1 (PK:2:3),Mostek,,zápis uzavřen delegace,2025-10-04,11:00:00,739528,2025-10-04 11:00:00,Fotbalový klub Mostek - Podhůří/Vrchlabí B,False,Fotbalový klub Mostek,V,OP mladších žáků,Ml. žáci,Ml_zaci,6,
04.10.2025 11:00,TJ Jiskra Kocbeře,FK Poříčí u Trutnova,4 : 1 (PK:0:0),Kocbeře,,zápis uzavřen delegace,2025-10-04,11:00:00,739528,2025-10-04 11:00:00,TJ Jiskra Kocbeře - FK Poříčí u Trutnova,False,TJ Jiskra Kocbeře,V,OP mladších žáků,Ml. žáci,Ml_zaci,6,
08.10.2025 15:45,Fotbalový klub Mostek,Sokol Vítězná,2 : 1 (PK:0:0),Mostek,,zápis uzavřen delegace,2025-10-08,15:45:00,739532,2025-10-08 15:45:00,Fotbalový klub Mostek - Sokol Vítězná,False,Fotbalový klub Mostek,V,OP mladších žáků,Ml. žáci,Ml_zaci,6,
08.10.2025 16:15,Podhůří/Vrchlabí B,FK Poříčí u Trutnova,5 : 0 (PK:0:0),Podhůří,,zápis uzavřen delegace,2025-10-08,16:15:00,739532,2025-10-08 16:15:00,Podhůří/Vrchlabí B - FK Poříčí u Trutnova,False,Podhůří/Vrchlabí B,V,OP mladších žáků,Ml. žáci,Ml_zaci,6,
08.10.2025 16:15,FK Dolní Kalná,Sportovní klub MFC Svoboda,8 : 0 (PK:0:0),Dolní Kalná,,zápis uzavřen delegace,2025-10-08,16:15:00,739532,2025-10-08 16:15:00,FK Dolní Kalná - Sportovní klub MFC Svoboda,False,FK Dolní Kalná,V,OP mladších žáků,Ml. žáci,Ml_zaci,6,
08.10.2025 16:15,TJ Jiskra Kocbeře,TJ SOKOL Bílá Třemešná,2 : 1 (PK:0:0),Kocbeře,,zápis uzavřen delegace,2025-10-08,16:15:00,739532,2025-10-08 16:15:00,TJ Jiskra Kocbeře - TJ SOKOL Bílá Třemešná,True,TJ Jiskra Kocbeře,V,OP mladších žáků,Ml. žáci,Ml_zaci,6,
08.10.2025 16:15,TJ Sokol Malé Svatoňovice,TJ Lánov,2 : 0 (PK:0:0),M.Svatoňovice,,zápis uzavřen delegace,2025-10-08,16:15:00,739532,2025-10-08 16:15:00,TJ Sokol Malé Svatoňovice - TJ Lánov,False,TJ Sokol Malé Svatoňovice,V,OP mladších žáků,Ml. žáci,Ml_zaci,6,
08.10.2025 16:45,TJ Spartak Pilníkov,Sokol Vítězná,0 : 3 (PK:0:0),Mostek,,zápis uzavřen delegace,2025-10-08,16:45:00,739532,2025-10-08 16:45:00,TJ Spartak Pilníkov - Sokol Vítězná,False,TJ Spartak Pilníkov,V,OP mladších žáků,Ml. žáci,Ml_zaci,6,
08.10.2025 17:15,Podhůří/Vrchlabí B,FK Poříčí u Trutnova,2 : 3 (PK:0:0),Podhůří,,zápis uzavřen delegace,2025-10-08,17:15:00,739532,2025-10-08 17:15:00,Podhůří/Vrchlabí B - FK Poříčí u Trutnova,False,Podhůří/Vrchlabí B,V,OP mladších žáků,Ml. žáci,Ml_zaci,6,
08.10.2025 17:15,TJ Jiskra Kocbeře,TJ SOKOL Bílá Třemešná,1 : 0 (PK:0:0),Kocbeře,,zápis uzavřen delegace,2025-10-08,17:15:00,739532,2025-10-08 17:15:00,TJ Jiskra Kocbeře - TJ SOKOL Bílá Třemešná,True,TJ Jiskra Kocbeře,V,OP mladších žáků,Ml. žáci,Ml_zaci,6,
08.10.2025 17:15,FK Dolní Kalná,Sportovní klub MFC Svoboda,7 : 2 (PK:0:0),Dolní Kalná,,zápis uzavřen delegace,2025-10-08,17:15:00,739532,2025-10-08 17:15:00,FK Dolní Kalná - Sportovní klub MFC Svoboda,False,FK Dolní Kalná,V,OP mladších žáků,Ml. žáci,Ml_zaci,6,
08.10.2025 17:15,TJ Sokol Malé Svatoňovice,TJ Lánov,4 : 0 (PK:0:0),M.Svatoňovice,,zápis uzavřen delegace,2025-10-08,17:15:00,739532,2025-10-08 17:15:00,TJ Sokol Malé Svatoňovice - TJ Lánov,False,TJ Sokol Malé Svatoňovice,V,OP mladších žáků,Ml. žáci,Ml_zaci,6,
08.10.2025 17:45,Fotbalový klub Mostek,TJ Spartak Pilníkov,2 : 4 (PK:0:0),Mostek,,zápis uzavřen delegace,2025-10-08,17:45:00,739532,2025-10-08 17:45:00,Fotbalový klub Mostek - TJ Spartak Pilníkov,False,Fotbalový klub Mostek,V,OP mladších žáků,Ml. žáci,Ml_zaci,6,
23.10.2025 16:00,TJ Lánov,Fotbalový klub Mostek,1 : 4 (PK:0:0),Lánov,"/ , Původní termín: 11.10.2025 10:00, Původní termín: 16.10.2025 16:30",zápis uzavřen delegace,2025-10-23,16:00:00,739547,2025-10-23 16:00:00,TJ Lánov - Fotbalový klub Mostek,False,TJ Lánov,V,OP mladších žáků,Ml. žáci,Ml_zaci,6,  Původní termín: 11.10.2025 10:00 Původní termín: 16.10.2025 16:30
23.10.2025 17:00,TJ Lánov,Fotbalový klub Mostek,2 : 2 (PK:3:1),Lánov,", Původní termín: 11.10.2025 11:00, Původní termín: 16.10.2025 17:30",zápis uzavřen delegace,2025-10-23,17:00:00,739547,2025-10-23 17:00:00,TJ Lánov - Fotbalový klub Mostek,False,TJ Lánov,V,OP mladších žáků,Ml. žáci,Ml_zaci,6, Původní termín: 11.10.2025 11:00 Původní termín: 16.10.2025 17:30
12.10.2025 10:00,FK Poříčí u Trutnova,FK Dolní Kalná,0 : 6 (PK:0:0),Poříčí,,zápis uzavřen delegace,2025-10-12,10:00:00,739536,2025-10-12 10:00:00,FK Poříčí u Trutnova - FK Dolní Kalná,False,FK Poříčí u Trutnova,V,OP mladších žáků,Ml. žáci,Ml_zaci,6,
12.10.2025 11:00,Sportovní klub MFC Svoboda,FK Dolní Kalná,0 : 3 (PK:0:0),Poříčí,,zápis uzavřen delegace,2025-10-12,11:00:00,739536,2025-10-12 11:00:00,Sportovní klub MFC Svoboda - FK Dolní Kalná,False,Sportovní klub MFC Svoboda,V,OP mladších žáků,Ml. žáci,Ml_zaci,6,
12.10.2025 12:00,FK Poříčí u Trutnova,Sportovní klub MFC Svoboda,2 : 0 (PK:0:0),Poříčí,,zápis uzavřen delegace,2025-10-12,12:00:00,739536,2025-10-12 12:00:00,FK Poříčí u Trutnova - Sportovní klub MFC Svoboda,False,FK Poříčí u Trutnova,V,OP mladších žáků,Ml. žáci,Ml_zaci,6,
11.10.2025 10:00,Podhůří/Vrchlabí B,TJ Sokol Malé Svatoňovice,0 : 3 (PK:0:0),Podhůří,,zápis uzavřen delegace,2025-10-11,10:00:00,739535,2025-10-11 10:00:00,Podhůří/Vrchlabí B - TJ Sokol Malé Svatoňovice,False,Podhůří/Vrchlabí B,V,OP mladších žáků,Ml. žáci,Ml_zaci,6,
11.10.2025 10:00,TJ SOKOL Bílá Třemešná,Sokol Vítězná,2 : 0 (PK:0:0),B.Třemešná,,zápis uzavřen delegace,2025-10-11,10:00:00,739535,2025-10-11 10:00:00,TJ SOKOL Bílá Třemešná - Sokol Vítězná,True,Sokol Vítězná,D,OP mladších žáků,Ml. žáci,Ml_zaci,6,
11.10.2025 11:00,TJ SOKOL Bílá Třemešná,Sokol Vítězná,1 : 3 (PK:0:0),B.Třemešná,,zápis uzavřen delegace,2025-10-11,11:00:00,739535,2025-10-11 11:00:00,TJ SOKOL Bílá Třemešná - Sokol Vítězná,True,Sokol Vítězná,D,OP mladších žáků,Ml. žáci,Ml_zaci,6,
11.10.2025 14:00,TJ Spartak Pilníkov,TJ Jiskra Kocbeře,3 : 2 (PK:0:0),Pilníkov,,zápis uzavřen delegace,2025-10-11,14:00:00,739535,2025-10-11 14:00:00,TJ Spartak Pilníkov - TJ Jiskra Kocbeře,False,TJ Spartak Pilníkov,V,OP mladších žáků,Ml. žáci,Ml_zaci,6,
11.10.2025 11:00,Podhůří/Vrchlabí B,TJ Sokol Malé Svatoňovice,1 : 2 (PK:0:0),Podhůří,,zápis uzavřen delegace,2025-10-11,11:00:00,739535,2025-10-11 11:00:00,Podhůří/Vrchlabí B - TJ Sokol Malé Svatoňovice,False,Podhůří/Vrchlabí B,V,OP mladších žáků,Ml. žáci,Ml_zaci,6,
11.10.2025 13:00,TJ Spartak Pilníkov,TJ Jiskra Kocbeře,2 : 0 (PK:0:0),Pilníkov,,zápis uzavřen delegace,2025-10-11,13:00:00,739535,2025-10-11 13:00:00,TJ Spartak Pilníkov - TJ Jiskra Kocbeře,False,TJ Spartak Pilníkov,V,OP mladších žáků,Ml. žáci,Ml_zaci,6,
19.10.2025 10:00,Fotbalový klub Mostek,FK Poříčí u Trutnova,2 : 0 (PK:0:0),Mostek,,zápis uzavřen delegace,2025-10-19,10:00:00,739543,2025-10-19 10:00:00,Fotbalový klub Mostek - FK Poříčí u Trutnova,False,Fotbalový klub Mostek,V,OP mladších žáků,Ml. žáci,Ml_zaci,6,
19.10.2025 10:00,Sokol Vítězná,TJ Lánov,0 : 0 (PK:1:3),Vítězná,", Původní termín: 18.10.2025 09:00",zápis uzavřen delegace,2025-10-19,10:00:00,739543,2025-10-19 10:00:00,Sokol Vítězná - TJ Lánov,False,Sokol Vítězná,V,OP mladších žáků,Ml. žáci,Ml_zaci,6, Původní termín: 18.10.2025 09:00
19.10.2025 10:00,TJ Jiskra Kocbeře,Podhůří/Vrchlabí B,3 : 2 (PK:0:0),Kocbeře,,zápis uzavřen delegace,2025-10-19,10:00:00,739543,2025-10-19 10:00:00,TJ Jiskra Kocbeře - Podhůří/Vrchlabí B,False,TJ Jiskra Kocbeře,V,OP mladších žáků,Ml. žáci,Ml_zaci,6,
19.10.2025 11:00,Sokol Vítězná,TJ Lánov,1 : 3 (PK:0:0),Vítězná,", Původní termín: 18.10.2025 10:00",zápis uzavřen delegace,2025-10-19,11:00:00,739543,2025-10-19 11:00:00,Sokol Vítězná - TJ Lánov,False,Sokol Vítězná,V,OP mladších žáků,Ml. žáci,Ml_zaci,6, Původní termín: 18.10.2025 10:00
19.10.2025 11:00,TJ Jiskra Kocbeře,Podhůří/Vrchlabí B,0 : 2 (PK:0:0),Kocbeře,,zápis uzavřen delegace,2025-10-19,11:00:00,739543,2025-10-19 11:00:00,TJ Jiskra Kocbeře - Podhůří/Vrchlabí B,False,TJ Jiskra Kocbeře,V,OP mladších žáků,Ml. žáci,Ml_zaci,6,
19.10.2025 13:00,FK Dolní Kalná,TJ Spartak Pilníkov,4 : 3 (PK:0:0),Dolní Kalná,,zápis uzavřen delegace,2025-10-19,13:00:00,739543,2025-10-19 13:00:00,FK Dolní Kalná - TJ Spartak Pilníkov,False,FK Dolní Kalná,V,OP mladších žáků,Ml. žáci,Ml_zaci,6,
19.10.2025 11:00,Fotbalový klub Mostek,FK Poříčí u Trutnova,1 : 1 (PK:3:2),Mostek,,zápis uzavřen delegace,2025-10-19,11:00:00,739543,2025-10-19 11:00:00,Fotbalový klub Mostek - FK Poříčí u Trutnova,False,Fotbalový klub Mostek,V,OP mladších žáků,Ml. žáci,Ml_zaci,6,
19.10.2025 14:00,FK Dolní Kalná,TJ Spartak Pilníkov,3 : 2 (PK:0:0),Dolní Kalná,,zápis uzavřen delegace,2025-10-19,14:00:00,739543,2025-10-19 14:00:00,FK Dolní Kalná - TJ Spartak Pilníkov,False,FK Dolní Kalná,V,OP mladších žáků,Ml. žáci,Ml_zaci,6,
18.10.2025 12:00,Sportovní klub MFC Svoboda,TJ Sokol Malé Svatoňovice,1 : 1 (PK:4:3),Svoboda,,zápis uzavřen delegace,2025-10-18,12:00:00,739542,2025-10-18 12:00:00,Sportovní klub MFC Svoboda - TJ Sokol Malé Svatoňovice,False,Sportovní klub MFC Svoboda,V,OP mladších žáků,Ml. žáci,Ml_zaci,6,
18.10.2025 10:00,Sportovní klub MFC Svoboda,TJ SOKOL Bílá Třemešná,0 : 2 (PK:0:0),Svoboda,,zápis uzavřen delegace,2025-10-18,10:00:00,739542,2025-10-18 10:00:00,Sportovní klub MFC Svoboda - TJ SOKOL Bílá Třemešná,True,Sportovní klub MFC Svoboda,V,OP mladších žáků,Ml. žáci,Ml_zaci,6,
18.10.2025 11:00,TJ Sokol Malé Svatoňovice,TJ SOKOL Bílá Třemešná,0 : 1 (PK:0:0),Svoboda,,zápis uzavřen delegace,2025-10-18,11:00:00,739542,2025-10-18 11:00:00,TJ Sokol Malé Svatoňovice - TJ SOKOL Bílá Třemešná,True,TJ Sokol Malé Svatoňovice,V,OP mladších žáků,Ml. žáci,Ml_zaci,6,
26.10.2025 10:00,Sportovní klub MFC Svoboda,TJ Lánov,1 : 1 (PK:2:0),Svoboda,,zápis uzavřen delegace,2025-10-26,10:00:00,739550,2025-10-26 10:00:00,Sportovní klub MFC Svoboda - TJ Lánov,False,Sportovní klub MFC Svoboda,V,OP mladších žáků,Ml. žáci,Ml_zaci,6,
26.10.2025 12:00,Sportovní klub MFC Svoboda,TJ SOKOL Bílá Třemešná,5 : 0 (PK:0:0),Svoboda,,zápis uzavřen delegace,2025-10-26,12:00:00,739550,2025-10-26 12:00:00,Sportovní klub MFC Svoboda - TJ SOKOL Bílá Třemešná,True,Sportovní klub MFC Svoboda,V,OP mladších žáků,Ml. žáci,Ml_zaci,6,
26.10.2025 11:00,TJ SOKOL Bílá Třemešná,TJ Lánov,0 : 1 (PK:0:0),Svoboda,,zápis uzavřen delegace,2025-10-26,11:00:00,739550,2025-10-26 11:00:00,TJ SOKOL Bílá Třemešná - TJ Lánov,True,TJ Lánov,D,OP mladších žáků,Ml. žáci,Ml_zaci,6,
25.10.2025 11:00,TJ Jiskra Kocbeře,TJ Sokol Malé Svatoňovice,0 : 3 (PK:0:0),Kocbeře,,zápis uzavřen delegace,2025-10-25,11:00:00,739549,2025-10-25 11:00:00,TJ Jiskra Kocbeře - TJ Sokol Malé Svatoňovice,False,TJ Jiskra Kocbeře,V,OP mladších žáků,Ml. žáci,Ml_zaci,6,
25.10.2025 10:00,TJ Jiskra Kocbeře,TJ Sokol Malé Svatoňovice,0 : 4 (PK:0:0),Kocbeře,,zápis uzavřen delegace,2025-10-25,10:00:00,739549,2025-10-25 10:00:00,TJ Jiskra Kocbeře - TJ Sokol Malé Svatoňovice,False,TJ Jiskra Kocbeře,V,OP mladších žáků,Ml. žáci,Ml_zaci,6,
25.10.2025 10:00,Fotbalový klub Mostek,TJ Spartak Pilníkov,3 : 0 (PK:0:0),Mostek,,zápis uzavřen delegace,2025-10-25,10:00:00,739549,2025-10-25 10:00:00,Fotbalový klub Mostek - TJ Spartak Pilníkov,False,Fotbalový klub Mostek,V,OP mladších žáků,Ml. žáci,Ml_zaci,6,
25.10.2025 11:00,Fotbalový klub Mostek,TJ Spartak Pilníkov,0 : 1 (PK:0:0),Mostek,,zápis uzavřen delegace,2025-10-25,11:00:00,739549,2025-10-25 11:00:00,Fotbalový klub Mostek - TJ Spartak Pilníkov,False,Fotbalový klub Mostek,V,OP mladších žáků,Ml. žáci,Ml_zaci,6,
25.10.2025 12:00,FK Dolní Kalná,Podhůří/Vrchlabí B,1 : 0 (PK:0:0),Dolní Kalná,,zápis uzavřen delegace,2025-10-25,12:00:00,739549,2025-10-25 12:00:00,FK Dolní Kalná - Podhůří/Vrchlabí B,False,FK Dolní Kalná,V,OP mladších žáků,Ml. žáci,Ml_zaci,6,
25.10.2025 12:00,Sokol Vítězná,FK Poříčí u Trutnova,2 : 1 (PK:0:0),Vítězná,,zápis uzavřen delegace,2025-10-25,12:00:00,739549,2025-10-25 12:00:00,Sokol Vítězná - FK Poříčí u Trutnova,False,Sokol Vítězná,V,OP mladších žáků,Ml. žáci,Ml_zaci,6,
25.10.2025 11:00,Sokol Vítězná,FK Poříčí u Trutnova,2 : 2 (PK:2:1),Vítězná,,zápis uzavřen delegace,2025-10-25,11:00:00,739549,2025-10-25 11:00:00,Sokol Vítězná - FK Poříčí u Trutnova,False,Sokol Vítězná,V,OP mladších žáků,Ml. žáci,Ml_zaci,6,
25.10.2025 13:00,FK Dolní Kalná,Podhůří/Vrchlabí B,6 : 1 (PK:0:0),Dolní Kalná,,zápis uzavřen delegace,2025-10-25,13:00:00,739549,2025-10-25 13:00:00,FK Dolní Kalná - Podhůří/Vrchlabí B,False,FK Dolní Kalná,V,OP mladších žáků,Ml. žáci,Ml_zaci,6,
02.11.2025 10:00,FK Poříčí u Trutnova,Sportovní klub MFC Svoboda,2 : 0 (PK:0:0),Poříčí,,zápis uzavřen delegace,2025-11-02,10:00:00,739557,2025-11-02 10:00:00,FK Poříčí u Trutnova - Sportovní klub MFC Svoboda,False,FK Poříčí u Trutnova,V,OP mladších žáků,Ml. žáci,Ml_zaci,6,
02.11.2025 12:00,FK Poříčí u Trutnova,TJ Jiskra Kocbeře,1 : 1 (PK:1:2),Poříčí,,zápis uzavřen delegace,2025-11-02,12:00:00,739557,2025-11-02 12:00:00,FK Poříčí u Trutnova - TJ Jiskra Kocbeře,False,FK Poříčí u Trutnova,V,OP mladších žáků,Ml. žáci,Ml_zaci,6,
02.11.2025 11:00,TJ Jiskra Kocbeře,Sportovní klub MFC Svoboda,3 : 0 (PK:0:0),Poříčí,,zápis uzavřen delegace,2025-11-02,11:00:00,739557,2025-11-02 11:00:00,TJ Jiskra Kocbeře - Sportovní klub MFC Svoboda,False,TJ Jiskra Kocbeře,V,OP mladších žáků,Ml. žáci,Ml_zaci,6,
01.11.2025 10:00,Podhůří/Vrchlabí B,Fotbalový klub Mostek,3 : 2 (PK:0:0),Podhůří,,zápis uzavřen delegace,2025-11-01,10:00:00,739556,2025-11-01 10:00:00,Podhůří/Vrchlabí B - Fotbalový klub Mostek,False,Podhůří/Vrchlabí B,V,OP mladších žáků,Ml. žáci,Ml_zaci,6,
01.11.2025 10:00,TJ Spartak Pilníkov,Sokol Vítězná,1 : 0 (PK:0:0),Pilníkov,,zápis uzavřen delegace,2025-11-01,10:00:00,739556,2025-11-01 10:00:00,TJ Spartak Pilníkov - Sokol Vítězná,False,TJ Spartak Pilníkov,V,OP mladších žáků,Ml. žáci,Ml_zaci,6,
01.11.2025 10:00,TJ Sokol Malé Svatoňovice,FK Dolní Kalná,1 : 5 (PK:0:0),M.Svatoňovice,,zápis uzavřen delegace,2025-11-01,10:00:00,739556,2025-11-01 10:00:00,TJ Sokol Malé Svatoňovice - FK Dolní Kalná,False,TJ Sokol Malé Svatoňovice,V,OP mladších žáků,Ml. žáci,Ml_zaci,6,
01.11.2025 10:00,TJ SOKOL Bílá Třemešná,TJ Lánov,1 : 0 (PK:0:0),B.Třemešná,,zápis uzavřen delegace,2025-11-01,10:00:00,739556,2025-11-01 10:00:00,TJ SOKOL Bílá Třemešná - TJ Lánov,True,TJ Lánov,D,OP mladších žáků,Ml. žáci,Ml_zaci,6,
01.11.2025 11:00,TJ SOKOL Bílá Třemešná,TJ Lánov,0 : 1 (PK:0:0),Bílá Třemešná,,zápis uzavřen delegace,2025-11-01,11:00:00,739556,2025-11-01 11:00:00,TJ SOKOL Bílá Třemešná - TJ Lánov,True,TJ Lánov,D,OP mladších žáků,Ml. žáci,Ml_zaci,6,
01.11.2025 11:00,TJ Spartak Pilníkov,Sokol Vítězná,0 : 2 (PK:0:0),Pilníkov,,zápis uzavřen delegace,2025-11-01,11:00:00,739556,2025-11-01 11:00:00,TJ Spartak Pilníkov - Sokol Vítězná,False,TJ Spartak Pilníkov,V,OP mladších žáků,Ml. žáci,Ml_zaci,6,
01.11.2025 11:00,Podhůří/Vrchlabí B,Fotbalový klub Mostek,1 : 2 (PK:0:0),Podhůří,,zápis uzavřen delegace,2025-11-01,11:00:00,739556,2025-11-01 11:00:00,Podhůří/Vrchlabí B - Fotbalový klub Mostek,False,Podhůří/Vrchlabí B,V,OP mladších žáků,Ml. žáci,Ml_zaci,6,
01.11.2025 11:00,TJ Sokol Malé Svatoňovice,FK Dolní Kalná,1 : 1 (PK:2:1),M.Svatoňovice,,zápis uzavřen delegace,2025-11-01,11:00:00,739556,2025-11-01 11:00:00,TJ Sokol Malé Svatoňovice - FK Dolní Kalná,False,TJ Sokol Malé Svatoňovice,V,OP mladších žáků,Ml. žáci,Ml_zaci,6,
31.08.2025 11:00,FK Baník Radvanice v Č.,TJ Sokol Malé Svatoňovice,4 : 11 (PK:0:0),Radvanice,,zápis uzavřen delegace,2025-08-31,11:00:00,739494,2025-08-31 11:00:00,FK Baník Radvanice v Č. - TJ Sokol Malé Svatoňovice,False,FK Baník Radvanice v Č.,V,OP starší přípravky,St. přípravka,St_pripravka,7,
31.08.2025 11:00,TJ Jiskra Kocbeře,TJ Rudník,5 : 4 (PK:0:0),Kocbeře,,zápis uzavřen delegace,2025-08-31,11:00:00,739494,2025-08-31 11:00:00,TJ Jiskra Kocbeře - TJ Rudník,False,TJ Jiskra Kocbeře,V,OP starší přípravky,St. přípravka,St_pripravka,7,
31.08.2025 10:00,TJ Jiskra Kocbeře,TJ Rudník,7 : 6 (PK:0:0),Kocbeře,,zápis uzavřen delegace,2025-08-31,10:00:00,739494,2025-08-31 10:00:00,TJ Jiskra Kocbeře - TJ Rudník,False,TJ Jiskra Kocbeře,V,OP starší přípravky,St. přípravka,St_pripravka,7,
31.08.2025 10:00,FK Baník Radvanice v Č.,TJ Sokol Malé Svatoňovice,3 : 6 (PK:0:0),Radvanice,,zápis uzavřen delegace,2025-08-31,10:00:00,739494,2025-08-31 10:00:00,FK Baník Radvanice v Č. - TJ Sokol Malé Svatoňovice,False,FK Baník Radvanice v Č.,V,OP starší přípravky,St. přípravka,St_pripravka,7,
31.08.2025 12:30,Fotbalový klub Mostek,Sokol Vítězná,5 : 7 (PK:0:0),Mostek,,zápis uzavřen delegace,2025-08-31,12:30:00,739494,2025-08-31 12:30:00,Fotbalový klub Mostek - Sokol Vítězná,False,Fotbalový klub Mostek,V,OP starší přípravky,St. přípravka,St_pripravka,7,
31.08.2025 13:30,Fotbalový klub Mostek,Sokol Vítězná,6 : 5 (PK:0:0),Mostek,,zápis uzavřen delegace,2025-08-31,13:30:00,739494,2025-08-31 13:30:00,Fotbalový klub Mostek - Sokol Vítězná,False,Fotbalový klub Mostek,V,OP starší přípravky,St. přípravka,St_pripravka,7,
30.08.2025 12:15,TJ SOKOL Bílá Třemešná,TJ Spartak Pilníkov,11 : 2 (PK:0:0),B.Třemešná,,zápis uzavřen delegace,2025-08-30,12:15:00,739493,2025-08-30 12:15:00,TJ SOKOL Bílá Třemešná - TJ Spartak Pilníkov,True,TJ Spartak Pilníkov,D,OP starší přípravky,St. přípravka,St_pripravka,7,
30.08.2025 13:15,TJ SOKOL Bílá Třemešná,TJ Spartak Pilníkov,11 : 1 (PK:0:0),B.Třemešná,,zápis uzavřen delegace,2025-08-30,13:15:00,739493,2025-08-30 13:15:00,TJ SOKOL Bílá Třemešná - TJ Spartak Pilníkov,True,TJ Spartak Pilníkov,D,OP starší přípravky,St. přípravka,St_pripravka,7,
30.08.2025 14:00,TJ Tatran Hostinné,Podhůří/Vrchlabí B,3 : 5 (PK:0:0),Hostinné,,zápis uzavřen delegace,2025-08-30,14:00:00,739493,2025-08-30 14:00:00,TJ Tatran Hostinné - Podhůří/Vrchlabí B,False,TJ Tatran Hostinné,V,OP starší přípravky,St. přípravka,St_pripravka,7,
30.08.2025 15:00,TJ Tatran Hostinné,Podhůří/Vrchlabí B,2 : 5 (PK:0:0),Hostinné,,zápis uzavřen delegace,2025-08-30,15:00:00,739493,2025-08-30 15:00:00,TJ Tatran Hostinné - Podhůří/Vrchlabí B,False,TJ Tatran Hostinné,V,OP starší přípravky,St. přípravka,St_pripravka,7,
27.08.2025 17:30,SK Sparta Úpice B,TJ Lánov,3 : 2 (PK:0:0),Úpice,", Původní termín: 30.08.2025 09:00",zápis uzavřen delegace,2025-08-27,17:30:00,739490,2025-08-27 17:30:00,SK Sparta Úpice B - TJ Lánov,False,SK Sparta Úpice B,V,OP starší přípravky,St. přípravka,St_pripravka,7, Původní termín: 30.08.2025 09:00
27.08.2025 18:30,SK Sparta Úpice B,TJ Lánov,4 : 1 (PK:0:0),Úpice,", Původní termín: 30.08.2025 10:00",zápis uzavřen delegace,2025-08-27,18:30:00,739490,2025-08-27 18:30:00,SK Sparta Úpice B - TJ Lánov,False,SK Sparta Úpice B,V,OP starší přípravky,St. přípravka,St_pripravka,7, Původní termín: 30.08.2025 10:00
21.09.2025 11:00,FK Baník Radvanice v Č.,Sokol Vítězná,3 : 5 (PK:0:0),Radvanice,", Původní termín: 15.09.2025 17:30",zápis uzavřen delegace,2025-09-21,11:00:00,739515,2025-09-21 11:00:00,FK Baník Radvanice v Č. - Sokol Vítězná,False,FK Baník Radvanice v Č.,V,OP starší přípravky,St. přípravka,St_pripravka,7, Původní termín: 15.09.2025 17:30
21.09.2025 10:00,FK Baník Radvanice v Č.,Sokol Vítězná,1 : 6 (PK:0:0),Radvanice,", Původní termín: 15.09.2025 16:30",zápis uzavřen delegace,2025-09-21,10:00:00,739515,2025-09-21 10:00:00,FK Baník Radvanice v Č. - Sokol Vítězná,False,FK Baník Radvanice v Č.,V,OP starší přípravky,St. přípravka,St_pripravka,7, Původní termín: 15.09.2025 16:30
07.09.2025 09:30,TJ Sokol Malé Svatoňovice,TJ Tatran Hostinné,5 : 4 (PK:0:0),M.Svatoňovice,,zápis uzavřen delegace,2025-09-07,09:30:00,739501,2025-09-07 09:30:00,TJ Sokol Malé Svatoňovice - TJ Tatran Hostinné,False,TJ Sokol Malé Svatoňovice,V,OP starší přípravky,St. přípravka,St_pripravka,7,
07.09.2025 10:00,Podhůří/Vrchlabí B,TJ SOKOL Bílá Třemešná,3 : 5 (PK:0:0),Podhůří,,zápis uzavřen delegace,2025-09-07,10:00:00,739501,2025-09-07 10:00:00,Podhůří/Vrchlabí B - TJ SOKOL Bílá Třemešná,True,Podhůří/Vrchlabí B,V,OP starší přípravky,St. přípravka,St_pripravka,7,
07.09.2025 11:00,Podhůří/Vrchlabí B,TJ SOKOL Bílá Třemešná,11 : 4 (PK:0:0),Podhůří,,zápis uzavřen delegace,2025-09-07,11:00:00,739501,2025-09-07 11:00:00,Podhůří/Vrchlabí B - TJ SOKOL Bílá Třemešná,True,Podhůří/Vrchlabí B,V,OP starší přípravky,St. přípravka,St_pripravka,7,
07.09.2025 10:30,TJ Sokol Malé Svatoňovice,TJ Tatran Hostinné,7 : 4 (PK:0:0),M.Svatoňovice,,zápis uzavřen delegace,2025-09-07,10:30:00,739501,2025-09-07 10:30:00,TJ Sokol Malé Svatoňovice - TJ Tatran Hostinné,False,TJ Sokol Malé Svatoňovice,V,OP starší přípravky,St. přípravka,St_pripravka,7,
06.09.2025 10:00,TJ Rudník,SK Sparta Úpice B,2 : 15 (PK:0:0),Rudník,,zápis uzavřen delegace,2025-09-06,10:00:00,739500,2025-09-06 10:00:00,TJ Rudník - SK Sparta Úpice B,False,TJ Rudník,V,OP starší přípravky,St. přípravka,St_pripravka,7,
06.09.2025 10:30,TJ Spartak Pilníkov,TJ Jiskra Kocbeře,0 : 12 (PK:0:0),Pilníkov,,zápis uzavřen delegace,2025-09-06,10:30:00,739500,2025-09-06 10:30:00,TJ Spartak Pilníkov - TJ Jiskra Kocbeře,False,TJ Spartak Pilníkov,V,OP starší přípravky,St. přípravka,St_pripravka,7,
06.09.2025 11:00,TJ Rudník,SK Sparta Úpice B,5 : 9 (PK:0:0),Rudník,,zápis uzavřen delegace,2025-09-06,11:00:00,739500,2025-09-06 11:00:00,TJ Rudník - SK Sparta Úpice B,False,TJ Rudník,V,OP starší přípravky,St. přípravka,St_pripravka,7,
06.09.2025 11:30,TJ Spartak Pilníkov,TJ Jiskra Kocbeře,4 : 12 (PK:0:0),Pilníkov,,zápis uzavřen delegace,2025-09-06,11:30:00,739500,2025-09-06 11:30:00,TJ Spartak Pilníkov - TJ Jiskra Kocbeře,False,TJ Spartak Pilníkov,V,OP starší přípravky,St. přípravka,St_pripravka,7,
03.09.2025 16:00,TJ Lánov,Fotbalový klub Mostek,4 : 7 (PK:0:0),Lánov,"/ , Původní termín: 07.09.2025 10:00",zápis uzavřen delegace,2025-09-03,16:00:00,739497,2025-09-03 16:00:00,TJ Lánov - Fotbalový klub Mostek,False,TJ Lánov,V,OP starší přípravky,St. přípravka,St_pripravka,7,  Původní termín: 07.09.2025 10:00
03.09.2025 17:00,TJ Lánov,Fotbalový klub Mostek,10 : 6 (PK:0:0),Lánov,", Původní termín: 07.09.2025 11:00",zápis uzavřen delegace,2025-09-03,17:00:00,739497,2025-09-03 17:00:00,TJ Lánov - Fotbalový klub Mostek,False,TJ Lánov,V,OP starší přípravky,St. přípravka,St_pripravka,7, Původní termín: 07.09.2025 11:00
16.09.2025 18:15,SK Sparta Úpice B,Fotbalový klub Mostek,5 : 5 (PK:0:0),Úpice,", Původní termín: 14.09.2025 15:00",zápis uzavřen delegace,2025-09-16,18:15:00,739510,2025-09-16 18:15:00,SK Sparta Úpice B - Fotbalový klub Mostek,False,SK Sparta Úpice B,V,OP starší přípravky,St. přípravka,St_pripravka,7, Původní termín: 14.09.2025 15:00
16.09.2025 17:15,SK Sparta Úpice B,Fotbalový klub Mostek,10 : 6 (PK:0:0),Úpice,", Původní termín: 14.09.2025 14:00",zápis uzavřen delegace,2025-09-16,17:15:00,739510,2025-09-16 17:15:00,SK Sparta Úpice B - Fotbalový klub Mostek,False,SK Sparta Úpice B,V,OP starší přípravky,St. přípravka,St_pripravka,7, Původní termín: 14.09.2025 14:00
14.09.2025 12:30,TJ Jiskra Kocbeře,Podhůří/Vrchlabí B,4 : 12 (PK:0:0),Kocbeře,,zápis uzavřen delegace,2025-09-14,12:30:00,739508,2025-09-14 12:30:00,TJ Jiskra Kocbeře - Podhůří/Vrchlabí B,False,TJ Jiskra Kocbeře,V,OP starší přípravky,St. přípravka,St_pripravka,7,
14.09.2025 12:30,TJ Lánov,FK Baník Radvanice v Č.,11 : 5 (PK:0:0),Lánov,,zápis uzavřen delegace,2025-09-14,12:30:00,739508,2025-09-14 12:30:00,TJ Lánov - FK Baník Radvanice v Č.,False,TJ Lánov,V,OP starší přípravky,St. přípravka,St_pripravka,7,
14.09.2025 13:30,TJ Jiskra Kocbeře,Podhůří/Vrchlabí B,3 : 7 (PK:0:0),Kocbeře,,zápis uzavřen delegace,2025-09-14,13:30:00,739508,2025-09-14 13:30:00,TJ Jiskra Kocbeře - Podhůří/Vrchlabí B,False,TJ Jiskra Kocbeře,V,OP starší přípravky,St. přípravka,St_pripravka,7,
14.09.2025 13:30,TJ Lánov,FK Baník Radvanice v Č.,12 : 3 (PK:0:0),Lánov,,zápis uzavřen delegace,2025-09-14,13:30:00,739508,2025-09-14 13:30:00,TJ Lánov - FK Baník Radvanice v Č.,False,TJ Lánov,V,OP starší přípravky,St. přípravka,St_pripravka,7,
13.09.2025 11:00,TJ Rudník,TJ Spartak Pilníkov,7 : 4 (PK:0:0),Rudník,,zápis uzavřen delegace,2025-09-13,11:00:00,739507,2025-09-13 11:00:00,TJ Rudník - TJ Spartak Pilníkov,False,TJ Rudník,V,OP starší přípravky,St. přípravka,St_pripravka,7,
13.09.2025 10:00,TJ Rudník,TJ Spartak Pilníkov,5 : 4 (PK:0:0),Rudník,,zápis uzavřen delegace,2025-09-13,10:00:00,739507,2025-09-13 10:00:00,TJ Rudník - TJ Spartak Pilníkov,False,TJ Rudník,V,OP starší přípravky,St. přípravka,St_pripravka,7,
13.09.2025 13:30,TJ SOKOL Bílá Třemešná,TJ Sokol Malé Svatoňovice,14 : 0 (PK:0:0),B.Třemešná,,zápis uzavřen delegace,2025-09-13,13:30:00,739507,2025-09-13 13:30:00,TJ SOKOL Bílá Třemešná - TJ Sokol Malé Svatoňovice,True,TJ Sokol Malé Svatoňovice,D,OP starší přípravky,St. přípravka,St_pripravka,7,
13.09.2025 12:30,TJ SOKOL Bílá Třemešná,TJ Sokol Malé Svatoňovice,11 : 1 (PK:0:0),B.Třemešná,,zápis uzavřen delegace,2025-09-13,12:30:00,739507,2025-09-13 12:30:00,TJ SOKOL Bílá Třemešná - TJ Sokol Malé Svatoňovice,True,TJ Sokol Malé Svatoňovice,D,OP starší přípravky,St. přípravka,St_pripravka,7,
13.09.2025 14:00,TJ Tatran Hostinné,Sokol Vítězná,4 : 7 (PK:0:0),Hostinné,,zápis uzavřen delegace,2025-09-13,14:00:00,739507,2025-09-13 14:00:00,TJ Tatran Hostinné - Sokol Vítězná,False,TJ Tatran Hostinné,V,OP starší přípravky,St. přípravka,St_pripravka,7,
13.09.2025 15:00,TJ Tatran Hostinné,Sokol Vítězná,7 : 7 (PK:0:0),Hostinné,,zápis uzavřen delegace,2025-09-13,15:00:00,739507,2025-09-13 15:00:00,TJ Tatran Hostinné - Sokol Vítězná,False,TJ Tatran Hostinné,V,OP starší přípravky,St. přípravka,St_pripravka,7,
28.09.2025 10:00,TJ SOKOL Bílá Třemešná,TJ Lánov,6 : 5 (PK:0:0),B.Třemešná,", Původní termín: 27.09.2025 13:30",zápis uzavřen delegace,2025-09-28,10:00:00,739522,2025-09-28 10:00:00,TJ SOKOL Bílá Třemešná - TJ Lánov,True,TJ Lánov,D,OP starší přípravky,St. přípravka,St_pripravka,7, Původní termín: 27.09.2025 13:30
28.09.2025 09:00,TJ SOKOL Bílá Třemešná,TJ Lánov,6 : 5 (PK:0:0),B.Třemešná,", Původní termín: 27.09.2025 12:30",zápis uzavřen delegace,2025-09-28,09:00:00,739522,2025-09-28 09:00:00,TJ SOKOL Bílá Třemešná - TJ Lánov,True,TJ Lánov,D,OP starší přípravky,St. přípravka,St_pripravka,7, Původní termín: 27.09.2025 12:30
27.09.2025 09:00,Sokol Vítězná,TJ Jiskra Kocbeře,4 : 2 (PK:0:0),Vítězná,,zápis uzavřen delegace,2025-09-27,09:00:00,739521,2025-09-27 09:00:00,Sokol Vítězná - TJ Jiskra Kocbeře,False,Sokol Vítězná,V,OP starší přípravky,St. přípravka,St_pripravka,7,
27.09.2025 09:00,SK Sparta Úpice B,FK Baník Radvanice v Č.,20 : 2 (PK:0:0),Úpice,,zápis uzavřen delegace,2025-09-27,09:00:00,739521,2025-09-27 09:00:00,SK Sparta Úpice B - FK Baník Radvanice v Č.,False,SK Sparta Úpice B,V,OP starší přípravky,St. přípravka,St_pripravka,7,
27.09.2025 11:00,TJ Tatran Hostinné,Fotbalový klub Mostek,4 : 5 (PK:0:0),Hostinné,,zápis uzavřen delegace,2025-09-27,11:00:00,739521,2025-09-27 11:00:00,TJ Tatran Hostinné - Fotbalový klub Mostek,False,TJ Tatran Hostinné,V,OP starší přípravky,St. přípravka,St_pripravka,7,
27.09.2025 10:00,TJ Tatran Hostinné,Fotbalový klub Mostek,10 : 6 (PK:0:0),Hostinné,,zápis uzavřen delegace,2025-09-27,10:00:00,739521,2025-09-27 10:00:00,TJ Tatran Hostinné - Fotbalový klub Mostek,False,TJ Tatran Hostinné,V,OP starší přípravky,St. přípravka,St_pripravka,7,
27.09.2025 10:00,Sokol Vítězná,TJ Jiskra Kocbeře,2 : 7 (PK:0:0),Vítězná,,zápis uzavřen delegace,2025-09-27,10:00:00,739521,2025-09-27 10:00:00,Sokol Vítězná - TJ Jiskra Kocbeře,False,Sokol Vítězná,V,OP starší přípravky,St. přípravka,St_pripravka,7,
27.09.2025 10:00,SK Sparta Úpice B,FK Baník Radvanice v Č.,12 : 1 (PK:0:0),Úpice,,zápis uzavřen delegace,2025-09-27,10:00:00,739521,2025-09-27 10:00:00,SK Sparta Úpice B - FK Baník Radvanice v Č.,False,SK Sparta Úpice B,V,OP starší přípravky,St. přípravka,St_pripravka,7,
27.09.2025 12:30,TJ Spartak Pilníkov,Podhůří/Vrchlabí B,3 : 13 (PK:0:0),Pilníkov,,zápis uzavřen delegace,2025-09-27,12:30:00,739521,2025-09-27 12:30:00,TJ Spartak Pilníkov - Podhůří/Vrchlabí B,False,TJ Spartak Pilníkov,V,OP starší přípravky,St. přípravka,St_pripravka,7,
27.09.2025 11:30,TJ Spartak Pilníkov,Podhůří/Vrchlabí B,1 : 5 (PK:0:0),Pilníkov,,zápis uzavřen delegace,2025-09-27,11:30:00,739521,2025-09-27 11:30:00,TJ Spartak Pilníkov - Podhůří/Vrchlabí B,False,TJ Spartak Pilníkov,V,OP starší přípravky,St. přípravka,St_pripravka,7,
21.09.2025 10:00,TJ Rudník,TJ Sokol Malé Svatoňovice,3 : 2 (PK:0:0),Rudník,"Hřiště: NEZMĚNĚNO, Původní termín: 27.09.2025 10:00",zápis uzavřen delegace,2025-09-21,10:00:00,739515,2025-09-21 10:00:00,TJ Rudník - TJ Sokol Malé Svatoňovice,False,TJ Rudník,V,OP starší přípravky,St. přípravka,St_pripravka,7,Hřiště: NEZMĚNĚNO Původní termín: 27.09.2025 10:00
21.09.2025 11:00,TJ Rudník,TJ Sokol Malé Svatoňovice,3 : 2 (PK:0:0),Rudník,"Hřiště: NEZMĚNĚNO, Původní termín: 27.09.2025 11:00",zápis uzavřen delegace,2025-09-21,11:00:00,739515,2025-09-21 11:00:00,TJ Rudník - TJ Sokol Malé Svatoňovice,False,TJ Rudník,V,OP starší přípravky,St. přípravka,St_pripravka,7,Hřiště: NEZMĚNĚNO Původní termín: 27.09.2025 11:00
05.10.2025 10:00,Podhůří/Vrchlabí B,TJ Lánov,7 : 3 (PK:0:0),Podhůří,,zápis uzavřen delegace,2025-10-05,10:00:00,739529,2025-10-05 10:00:00,Podhůří/Vrchlabí B - TJ Lánov,False,Podhůří/Vrchlabí B,V,OP starší přípravky,St. přípravka,St_pripravka,7,
05.10.2025 10:00,TJ Sokol Malé Svatoňovice,Sokol Vítězná,2 : 5 (PK:0:0),M.Svatoňovice,,zápis uzavřen delegace,2025-10-05,10:00:00,739529,2025-10-05 10:00:00,TJ Sokol Malé Svatoňovice - Sokol Vítězná,False,TJ Sokol Malé Svatoňovice,V,OP starší přípravky,St. přípravka,St_pripravka,7,
05.10.2025 10:00,TJ Spartak Pilníkov,Fotbalový klub Mostek,3 : 7 (PK:0:0),Pilníkov,,zápis uzavřen delegace,2025-10-05,10:00:00,739529,2025-10-05 10:00:00,TJ Spartak Pilníkov - Fotbalový klub Mostek,False,TJ Spartak Pilníkov,V,OP starší přípravky,St. přípravka,St_pripravka,7,
05.10.2025 09:00,TJ Sokol Malé Svatoňovice,Sokol Vítězná,9 : 2 (PK:0:0),M.Svatoňovice,,zápis uzavřen delegace,2025-10-05,09:00:00,739529,2025-10-05 09:00:00,TJ Sokol Malé Svatoňovice - Sokol Vítězná,False,TJ Sokol Malé Svatoňovice,V,OP starší přípravky,St. přípravka,St_pripravka,7,
05.10.2025 11:00,Podhůří/Vrchlabí B,TJ Lánov,4 : 9 (PK:0:0),Podhůří,,zápis uzavřen delegace,2025-10-05,11:00:00,739529,2025-10-05 11:00:00,Podhůří/Vrchlabí B - TJ Lánov,False,Podhůří/Vrchlabí B,V,OP starší přípravky,St. přípravka,St_pripravka,7,
05.10.2025 11:00,TJ Spartak Pilníkov,Fotbalový klub Mostek,6 : 7 (PK:0:0),Pilníkov,,zápis uzavřen delegace,2025-10-05,11:00:00,739529,2025-10-05 11:00:00,TJ Spartak Pilníkov - Fotbalový klub Mostek,False,TJ Spartak Pilníkov,V,OP starší přípravky,St. přípravka,St_pripravka,7,
05.10.2025 13:00,TJ SOKOL Bílá Třemešná,SK Sparta Úpice B,5 : 13 (PK:0:0),B.Třemešná,,zápis uzavřen delegace,2025-10-05,13:00:00,739529,2025-10-05 13:00:00,TJ SOKOL Bílá Třemešná - SK Sparta Úpice B,True,SK Sparta Úpice B,D,OP starší přípravky,St. přípravka,St_pripravka,7,
05.10.2025 14:00,TJ SOKOL Bílá Třemešná,SK Sparta Úpice B,5 : 9 (PK:0:0),B.Třemešná,,zápis uzavřen delegace,2025-10-05,14:00:00,739529,2025-10-05 14:00:00,TJ SOKOL Bílá Třemešná - SK Sparta Úpice B,True,SK Sparta Úpice B,D,OP starší přípravky,St. přípravka,St_pripravka,7,
04.10.2025 13:30,TJ Jiskra Kocbeře,TJ Tatran Hostinné,3 : 8 (PK:0:0),Kocbeře,,zápis uzavřen delegace,2025-10-04,13:30:00,739528,2025-10-04 13:30:00,TJ Jiskra Kocbeře - TJ Tatran Hostinné,False,TJ Jiskra Kocbeře,V,OP starší přípravky,St. přípravka,St_pripravka,7,
04.10.2025 13:30,TJ Rudník,FK Baník Radvanice v Č.,6 : 2 (PK:0:0),Rudník,,zápis uzavřen delegace,2025-10-04,13:30:00,739528,2025-10-04 13:30:00,TJ Rudník - FK Baník Radvanice v Č.,False,TJ Rudník,V,OP starší přípravky,St. přípravka,St_pripravka,7,
04.10.2025 12:30,TJ Rudník,FK Baník Radvanice v Č.,9 : 2 (PK:0:0),Rudník,,zápis uzavřen delegace,2025-10-04,12:30:00,739528,2025-10-04 12:30:00,TJ Rudník - FK Baník Radvanice v Č.,False,TJ Rudník,V,OP starší přípravky,St. přípravka,St_pripravka,7,
04.10.2025 12:30,TJ Jiskra Kocbeře,TJ Tatran Hostinné,3 : 9 (PK:0:0),Kocbeře,,zápis uzavřen delegace,2025-10-04,12:30:00,739528,2025-10-04 12:30:00,TJ Jiskra Kocbeře - TJ Tatran Hostinné,False,TJ Jiskra Kocbeře,V,OP starší přípravky,St. přípravka,St_pripravka,7,
14.10.2025 17:15,TJ SOKOL Bílá Třemešná,TJ Jiskra Kocbeře,10 : 1 (PK:0:0),B.Třemešná,", Původní termín: 11.10.2025 13:30",zápis uzavřen delegace,2025-10-14,17:15:00,739538,2025-10-14 17:15:00,TJ SOKOL Bílá Třemešná - TJ Jiskra Kocbeře,True,TJ Jiskra Kocbeře,D,OP starší přípravky,St. přípravka,St_pripravka,7, Původní termín: 11.10.2025 13:30
14.10.2025 16:15,TJ SOKOL Bílá Třemešná,TJ Jiskra Kocbeře,7 : 3 (PK:0:0),B.Třemešná,", Původní termín: 11.10.2025 12:30",zápis uzavřen delegace,2025-10-14,16:15:00,739538,2025-10-14 16:15:00,TJ SOKOL Bílá Třemešná - TJ Jiskra Kocbeře,True,TJ Jiskra Kocbeře,D,OP starší přípravky,St. přípravka,St_pripravka,7, Původní termín: 11.10.2025 12:30
12.10.2025 10:00,SK Sparta Úpice B,Sokol Vítězná,13 : 1 (PK:0:0),Úpice,,zápis uzavřen delegace,2025-10-12,10:00:00,739536,2025-10-12 10:00:00,SK Sparta Úpice B - Sokol Vítězná,False,SK Sparta Úpice B,V,OP starší přípravky,St. přípravka,St_pripravka,7,
12.10.2025 09:00,SK Sparta Úpice B,Sokol Vítězná,9 : 2 (PK:0:0),Úpice,,zápis uzavřen delegace,2025-10-12,09:00:00,739536,2025-10-12 09:00:00,SK Sparta Úpice B - Sokol Vítězná,False,SK Sparta Úpice B,V,OP starší přípravky,St. přípravka,St_pripravka,7,
12.10.2025 10:00,TJ Lánov,TJ Sokol Malé Svatoňovice,7 : 3 (PK:0:0),Lánov,,zápis uzavřen delegace,2025-10-12,10:00:00,739536,2025-10-12 10:00:00,TJ Lánov - TJ Sokol Malé Svatoňovice,False,TJ Lánov,V,OP starší přípravky,St. přípravka,St_pripravka,7,
12.10.2025 10:00,Fotbalový klub Mostek,Podhůří/Vrchlabí B,2 : 15 (PK:0:0),Mostek,,zápis uzavřen delegace,2025-10-12,10:00:00,739536,2025-10-12 10:00:00,Fotbalový klub Mostek - Podhůří/Vrchlabí B,False,Fotbalový klub Mostek,V,OP starší přípravky,St. přípravka,St_pripravka,7,
12.10.2025 11:00,Fotbalový klub Mostek,Podhůří/Vrchlabí B,7 : 7 (PK:0:0),Mostek,,zápis uzavřen delegace,2025-10-12,11:00:00,739536,2025-10-12 11:00:00,Fotbalový klub Mostek - Podhůří/Vrchlabí B,False,Fotbalový klub Mostek,V,OP starší přípravky,St. přípravka,St_pripravka,7,
12.10.2025 11:00,TJ Lánov,TJ Sokol Malé Svatoňovice,12 : 4 (PK:0:0),Lánov,,zápis uzavřen delegace,2025-10-12,11:00:00,739536,2025-10-12 11:00:00,TJ Lánov - TJ Sokol Malé Svatoňovice,False,TJ Lánov,V,OP starší přípravky,St. přípravka,St_pripravka,7,
11.10.2025 14:00,TJ Tatran Hostinné,TJ Rudník,7 : 3 (PK:0:0),Hostinné,,zápis uzavřen delegace,2025-10-11,14:00:00,739535,2025-10-11 14:00:00,TJ Tatran Hostinné - TJ Rudník,False,TJ Tatran Hostinné,V,OP starší přípravky,St. přípravka,St_pripravka,7,
